Sheet: Character Sheet
A1: Name | C1: Fighter McWarrior | H1: Race | I1: Human | K1: Player | L1: Aaron
A2: Stats | C2: Total | D2: Base | E2: Misc. | F2: Mod
A3: Strength | C3: of:=[.D3]+[.E3] -> 22 | D3: 20 | E3: 2 | F3: of:=INT(([.C3]-10)/2) -> 6 | H3: Height | I3: 6’4” | K3: Alignment | L3: Neutral Good
A4: Dexterity | C4: of:=[.D4]+[.E4] -> 10 | D4: 12 | E4: -2 | F4: of:=INT(([.C4]-10)/2) -> 0 | H4: Weight | I4: 220 | K4: Level | L4: 10
A5: Constitution | C5: of:=[.D5]+[.E5] -> 16 | D5: 16 | E5: 0 | F5: of:=INT(([.C5]-10)/2) -> 3 | H5: Eyes | I5: Black | K5: XP | L5: 52411 | N5: of:=[.L4]*([.L4]+1)*500 -> 55000
A6: Intelligence | C6: of:=[.D6]+[.E6] -> 8 | D6: 8 | E6: 0 | F6: of:=INT(([.C6]-10)/2) -> -1 | H6: Appear. | I6: Pixelated | K6: Base GP | O6: of:=([.$L$4]+3)*[$Lookups.$J$15] -> 117
A7: Wisdom | C7: of:=[.D7]+[.E7] -> 8 | D7: 8 | E7: 0 | F7: of:=INT(([.C7]-10)/2) -> -1 | H7: Sex | I7: Yes! | K7: Unspent GP | O7: of:=[.O6]-[.O8] -> 2
A8: Charisma | C8: of:=[.D8]+[.E8] -> 10 | D8: 10 | E8: 0 | F8: of:=INT(([.C8]-10)/2) -> 0 | H8: Age | I8: 21 | K8: Spent GP | O8: of:=SUM([.O10:.O21]) -> 115
A9: Saving throws:
A10: Fortitude | C10: of:=SUM([.E10];[.G10];[.I10];[.K10];[.M10]) -> 13 | D10: Base | E10: of:=INT([.$L$4]/3) -> 3 | F10: Con | G10: of:=[.$F$5] -> 3 | H10: Magic | I10: 1 | J10: Misc | K10: 2 | L10: Extra | M10: 4 | N10: Cost | O10: of:=[.M10]*2 -> 8
A11: Reflex | C11: of:=SUM([.E11];[.G11];[.I11];[.K11];[.M11]) -> 9 | D11: Base | E11: of:=INT([.$L$4]/3) -> 3 | F11: Dex | G11: of:=[.$F$4] -> 0 | H11: Magic | I11: 1 | J11: Misc | K11: 2 | L11: Extra | M11: 3 | N11: Cost | O11: of:=[.M11]*2 -> 6
A12: Will | C12: of:=SUM([.E12];[.G12];[.I12];[.K12];[.M12]) -> 9 | D12: Base | E12: of:=INT([.$L$4]/3) -> 3 | F12: Wis | G12: of:=[.$F$7] -> -1 | H12: Magic | I12: 1 | J12: Misc | K12: 2 | L12: Extra | M12: 4 | N12: Cost | O12: of:=[.M12]*2 -> 8
A13: Base Attack Bonus:
A14: Melee | C14: of:=SUM([.E14];[.G14];[.I14];[.K14];[.M14]) -> 16 | D14: Base | E14: of:=INT([.$L$4]/2) -> 5 | F14: Str | G14: of:=[.$F$3] -> 6 | H14: Size | I14: of:=[$Lookups.$C$15] -> 0 | J14: Misc | L14: Extra | M14: 5 | N14: Cost | O14: of:=[.M14]*2 -> 10
A15: Range | C15: of:=SUM([.E15];[.G15];[.I15];[.K15];[.M15]) -> 5 | D15: Base | E15: of:=INT([.$L$4]/2) -> 5 | F15: Dex | G15: of:=[.$F$4] -> 0 | H15: Size | I15: of:=[$Lookups.$C$15] -> 0 | J15: Misc | L15: Extra | N15: Cost | O15: of:=[.M15]*2 -> 0
A16: Status:
A17: HP | B17: 105 | C17: / | D17: of:=[.G17]+[.I17]+[.K17]+[.M17] -> 123 | F17: Base | G17: of:=3*[.$L$4] -> 30 | H17: Con | I17: of:=[.$F$5]*[.$L$4] -> 30 | J17: Misc | L17: Extra | M17: 63 | N17: Cost | O17: of:=[.M17] -> 63
A18: SP | B18: 18 | C18: / | D18: of:=[.G18]+[.I18]+[.K18]+[.M18] -> 20 | F18: Base | G18: of:=3*[.$L$4] -> 30 | H18: Wis | I18: of:=[.$F$7]*[.$L$4] -> -10 | J18: Misc | L18: Extra | M18: of:=[.O18]*3 -> 0 | N18: Cost
A19: Bonus skills and feats:
A20: Skills | B20: of:=[Skills.J1] -> 12 | C20: / | D20: of:=[.G20]+[.I20]+[.M20] -> 13 | F20: Base | G20: of:=2*([.$L$4]+3) -> 26 | H20: Int | I20: of:=[.$F$6]*([.$L$4]+3) -> -13 | L20: Extra | N20: Cost | O20: of:=[.M20] -> 0
A21: Feats | B21: of:=[.G21]+[.M21] -> 23 | F21: Base | G21: of:=[.$L$4]+[$Lookups.$K$15] -> 19 | L21: Extra | M21: 4 | N21: Cost | O21: of:=[.M21]*5 -> 20
A22: Armor:
A23: AC | C23: of:=SUM([.J24:.J28];[.C28];[.C27])+10 -> 26 | E23: Type | F23: Item | J23: AC | K23: Max Dex | L23: Armor Check | M23: Spell Fail | N23: Weight | O23: Speed
A24: Flatfoot AC | C24: of:=SUM([.J24:.J26];[.J28];[.C28])+10 -> 24 | E24: Armor | F24: Full Plate +1 | J24: 9 | K24: 1 | L24: -6 | M24: 0.35 | N24: 50 | O24: 15
A25: Touch AC | C25: of:=SUM([.J28];[.J27];[.C28];[.C27];[.J26])+10 -> 14 | E25: Shield | F25: Heavy Shield +1 | J25: 3 | L25: -2 | M25: 0.15 | N25: 15
E26: Natural | F26: Amulet of Natural Armor +1 | J26: 1
A27: Dex AC Mod | C27: of:=MIN([.K24];[.F4]) -> 0 | E27: Dodge | J27: 2
A28: Size AC Mod | C28: of:=[$Lookups.$C$15] -> 0 | E28: Misc. | F28: Ring of Protection +1 | J28: 1
A29: Weapons:
A30: Item | F30: Total Attack Bonus | G30: Total Damage Bonus | H30: Attack type | I30: Attack Bonus | J30: Damage Bonus | K30: Damage | L30: Critical | M30: Range Incr. | N30: Weight | O30: Type
A31: Bastard Sword +2 Cold Iron | F31: of:=IF(OR([.H31]="Ranged";[.$H31]="Thrown");[.$C$15];[.$C$14])+[.$I31]-[.$C$38] -> 15 | G31: of:=[.$G$38]*LOOKUP([.$H31];[$Lookups.$B$28:$Lookups.$B$32];[$Lookups.$C$28:$Lookups.$C$32])+[.$J31] -> 15 | H31: Main-Hand | I31: 4 | J31: 4 | K31: 1d10 | L31: 17-20/×2 | N31: 6 | O31: Slash
A32: Throwing Swords: 5 | F32: of:=IF(OR([.H32]="Ranged";[.$H32]="Thrown");[.$C$15];[.$C$14])+[.$I32]-[.$C$38] -> 0 | G32: of:=[.$G$38]*LOOKUP([.$H32];[$Lookups.$B$28:$Lookups.$B$32];[$Lookups.$C$28:$Lookups.$C$32])+[.$J32] -> 11 | H32: Thrown | K32: 1d6 | L32: 19-20/×2 | N32: 2 | O32: Pierce
A33: Lesser Dwarven Thrower (+1 Returning) | F33: of:=IF(OR([.H33]="Ranged";[.$H33]="Thrown");[.$C$15];[.$C$14])+[.$I33]-[.$C$38] -> 12 | G33: of:=[.$G$38]*LOOKUP([.$H33];[$Lookups.$B$28:$Lookups.$B$32];[$Lookups.$C$28:$Lookups.$C$32])+[.$J33] -> 12 | H33: Main-Hand | I33: 1 | J33: 1 | O33: Bludg.
F34: of:=IF(OR([.H34]="Ranged";[.$H34]="Thrown");[.$C$15];[.$C$14])+[.$I34]-[.$C$38] -> 0 | G34: of:=[.$G$38]*LOOKUP([.$H34];[$Lookups.$B$28:$Lookups.$B$32];[$Lookups.$C$28:$Lookups.$C$32])+[.$J34] -> 0 | H34: Ranged
F35: of:=IF(OR([.H35]="Ranged";[.$H35]="Thrown");[.$C$15];[.$C$14])+[.$I35]-[.$C$38] -> 0 | G35: of:=[.$G$38]*LOOKUP([.$H35];[$Lookups.$B$28:$Lookups.$B$32];[$Lookups.$C$28:$Lookups.$C$32])+[.$J35] -> 0 | H35: Ranged
A37: Initiative | C37: of:=[.E37]+[.G37] -> 0 | D37: Dex | E37: of:=[.$F$4] -> 0 | F37: Misc | G37: 0
A38: Power Attack | C38: 5 | D38: Hit | E38: of:=[.C14]-[.C38] -> 11 | F38: Damage | G38: of:=[.$F$3]+[.C38] -> 11 | H38: Off Hand | J38: of:=INT(0.5*[.$G38]) -> 5 | K38: 2-Hand | L38: of:=INT(1.5*[.$G38]) -> 16 | M38: WP Finesse Hit | O38: of:=[.E38]-[.F3]+[.F4] -> 5
A40: Stat Buy Cost | C40: of:=[$Lookups.$G9] -> 43 | D40: Stat Bonus | F40: of:=[Lookups.H12] -> 2 | G40: Base Speed | I40: of:=[$Lookups.$M$15] -> 30
A41: Miscellaneous:
A42: Racial Abilities
A43: of:=[$Lookups.$L$15] -> Extra Feats and GP [Already Incoporated]
A44: Notes

Sheet: Feats
A1: Total | B1: of:=SUM([.B2:.B101]) -> 23 | C1: of | D1: of:=[$'Character Sheet'.$B$21] -> 23
A2: Arcane Caster Feats | C2: of:=MIN(INT([.B2]);[$'Character Sheet'.$L$4]) -> 0 | D2: Caster Level
A3: Extra Class Skills Feats | C3: of:=[.B3]*4+3 -> 3 | D3: Class Skills
A4: Weapon Prof [1 S 2 M] | B4: of:=LOOKUP([.C4];[$Lookups.$B$18:$Lookups.$B$21];[$Lookups.$C$18:$Lookups.$C$21]) -> 3 | C4: All Martial
A5: Armor Prof [0 L M H] | B5: of:=LOOKUP([.C5];[$Lookups.$B$23:$Lookups.$B$26];[$Lookups.$C$23:$Lookups.$C$26]) -> 3 | C5: Heavy
A6: Armor Caster [0 L M H] | B6: of:=LOOKUP([.C6];[$Lookups.$B$23:$Lookups.$B$26];[$Lookups.$C$23:$Lookups.$C$26]) -> 0 | C6: None
A7: Shield Proficiency | B7: of:=IF([.A7]="";0;1) -> 1
A8: Exotic: Bastard Sword | B8: of:=IF([.A8]="";0;1) -> 1
A9: Weapon Focus: Bastard Sword | B9: of:=IF([.A9]="";0;1) -> 1 | C9: +1 hit
A10: Weapon Spec: Bastard Sword | B10: of:=IF([.A10]="";0;1) -> 1 | C10: +2 damage
A11: Greater Weapon Focus: Bastard Sword | B11: of:=IF([.A11]="";0;1) -> 1 | C11: +1 hit
A12: Greater Weapon Spec: Bastard Sword | B12: 0 | C12: Requires BAB +12
A13: Improved Critical: Bastard Sword | B13: 1
A14: Power Attack | B14: of:=IF([.A14]="";0;1) -> 1
A15: Cleave | B15: of:=IF([.A15]="";0;1) -> 1
A16: Great Cleave | B16: of:=IF([.A16]="";0;1) -> 1
A17: Sneak Attack (+1d6) | B17: of:=IF([.A17]="";0;1) -> 1
A18: Dodge | B18: of:=IF([.A18]="";0;1) -> 1
A19: Mobility | B19: of:=IF([.A19]="";0;1) -> 1
A20: Uncanny Dodge | B20: 1 | C20: Keep dex bonus to AC even if flatfooted
A21: Improved Uncanny Dodge | B21: 1 | C21: Immune to flank, sneak attack
A22: Resolute Stance | B22: of:=IF([.A22]="";0;1) -> 1 | C22: +4 STR | D22: +4 AC | E22: +2 Saves | F22: 3+Con rounds | G22: 1/day | H22: Fatigued
A23: Mobile Defense | B23: 0 | C23: Requires BAB +15 | Take a 5-foot step per turn while in defensive stance
A24: Spirit Strike: Earth | B24: of:=IF([.A24]="";0;1) -> 1 | C24: cost: 5sp | D24: +2 hit/dmg | E24: Effect: Cold iron
A25: Improved Spirit Strike | B25: 0
A26: Improved Initiative | B26: 0
A27: Damage Reduction | B27: 1 | C27: 1/- damage reduction
B28: of:=IF([.A28]="";0;1) -> 0
B29: of:=IF([.A29]="";0;1) -> 0
B30: of:=IF([.A30]="";0;1) -> 0
B31: of:=IF([.A31]="";0;1) -> 0
B32: of:=IF([.A32]="";0;1) -> 0
B33: of:=IF([.A33]="";0;1) -> 0
B34: of:=IF([.A34]="";0;1) -> 0
B35: of:=IF([.A35]="";0;1) -> 0
B36: of:=IF([.A36]="";0;1) -> 0
B37: of:=IF([.A37]="";0;1) -> 0
B38: of:=IF([.A38]="";0;1) -> 0
B39: of:=IF([.A39]="";0;1) -> 0
B40: of:=IF([.A40]="";0;1) -> 0
B41: of:=IF([.A41]="";0;1) -> 0
B42: of:=IF([.A42]="";0;1) -> 0
B43: of:=IF([.A43]="";0;1) -> 0
B44: of:=IF([.A44]="";0;1) -> 0
B45: of:=IF([.A45]="";0;1) -> 0
B46: of:=IF([.A46]="";0;1) -> 0
B47: of:=IF([.A47]="";0;1) -> 0
B48: of:=IF([.A48]="";0;1) -> 0
B49: of:=IF([.A49]="";0;1) -> 0
B50: of:=IF([.A50]="";0;1) -> 0
B51: of:=IF([.A51]="";0;1) -> 0
B52: of:=IF([.A52]="";0;1) -> 0
B53: of:=IF([.A53]="";0;1) -> 0
B54: of:=IF([.A54]="";0;1) -> 0
B55: of:=IF([.A55]="";0;1) -> 0
B56: of:=IF([.A56]="";0;1) -> 0
B57: of:=IF([.A57]="";0;1) -> 0
B58: of:=IF([.A58]="";0;1) -> 0
B59: of:=IF([.A59]="";0;1) -> 0
B60: of:=IF([.A60]="";0;1) -> 0
B61: of:=IF([.A61]="";0;1) -> 0
B62: of:=IF([.A62]="";0;1) -> 0
B63: of:=IF([.A63]="";0;1) -> 0
B64: of:=IF([.A64]="";0;1) -> 0
B65: of:=IF([.A65]="";0;1) -> 0
B66: of:=IF([.A66]="";0;1) -> 0
B67: of:=IF([.A67]="";0;1) -> 0
B68: of:=IF([.A68]="";0;1) -> 0
B69: of:=IF([.A69]="";0;1) -> 0
B70: of:=IF([.A70]="";0;1) -> 0
B71: of:=IF([.A71]="";0;1) -> 0
B72: of:=IF([.A72]="";0;1) -> 0
B73: of:=IF([.A73]="";0;1) -> 0
B74: of:=IF([.A74]="";0;1) -> 0
B75: of:=IF([.A75]="";0;1) -> 0
B76: of:=IF([.A76]="";0;1) -> 0
B77: of:=IF([.A77]="";0;1) -> 0
B78: of:=IF([.A78]="";0;1) -> 0
B79: of:=IF([.A79]="";0;1) -> 0
B80: of:=IF([.A80]="";0;1) -> 0
B81: of:=IF([.A81]="";0;1) -> 0
B82: of:=IF([.A82]="";0;1) -> 0
B83: of:=IF([.A83]="";0;1) -> 0
B84: of:=IF([.A84]="";0;1) -> 0
B85: of:=IF([.A85]="";0;1) -> 0
B86: of:=IF([.A86]="";0;1) -> 0
B87: of:=IF([.A87]="";0;1) -> 0
B88: of:=IF([.A88]="";0;1) -> 0
B89: of:=IF([.A89]="";0;1) -> 0
B90: of:=IF([.A90]="";0;1) -> 0
B91: of:=IF([.A91]="";0;1) -> 0
B92: of:=IF([.A92]="";0;1) -> 0
B93: of:=IF([.A93]="";0;1) -> 0
B94: of:=IF([.A94]="";0;1) -> 0
B95: of:=IF([.A95]="";0;1) -> 0
B96: of:=IF([.A96]="";0;1) -> 0
B97: of:=IF([.A97]="";0;1) -> 0
B98: of:=IF([.A98]="";0;1) -> 0
B99: of:=IF([.A99]="";0;1) -> 0
B100: of:=IF([.A100]="";0;1) -> 0
B101: of:=IF([.A101]="";0;1) -> 0

Sheet: Skills
D1: Extra Class Skills | G1: of:=COUNTIF([.G3:.G7];"C")+COUNTIF([.G22:.G47];"C")+COUNTIF([.G51:.G54];"C")+COUNTIF([.G56:.G62];"C") -> 3 | H1: of | I1: of:=[$Feats.$C$3] -> 3 | J1: of:=SUM([.J3:.J62]) -> 12 | K1: Skill Points
A2: Skill | B2: Total | C2: Stat | D2: Mod | E2: Trained Only | F2: Armor Check Penalty | G2: Class Skill | H2: Misc | I2: Ranks | J2: Cost
A3: Appraise | B3: of:=IF(OR(NOT(UPPER([.E3])="YES");[.I3]>0);[.D3]+[.H3]+[.I3];"N/A") -> -1 | C3: Int | D3: of:=['Character Sheet'.$F$6] -> -1 | J3: of:=[.I3]*IF(OR(UPPER([.G3])="C";UPPER([.G3])="Y");1;2) -> 0
A4: Balance | B4: of:=IF(OR(NOT(UPPER([.E4])="YES");[.I4]>0);[.D4]+[.H4]+[.I4];"N/A") -> 0 | C4: Dex | D4: of:=['Character Sheet'.$F$4] -> 0 | F4: Yes | J4: of:=[.I4]*IF(OR(UPPER([.G4])="C";UPPER([.G4])="Y");1;2) -> 0
A5: Bluff | B5: of:=IF(OR(NOT(UPPER([.E5])="YES");[.I5]>0);[.D5]+[.H5]+[.I5];"N/A") -> 0 | C5: Cha | D5: of:=['Character Sheet'.$F$8] -> 0 | J5: of:=[.I5]*IF(OR(UPPER([.G5])="C";UPPER([.G5])="Y");1;2) -> 0
A6: Climb | B6: of:=IF(OR(NOT(UPPER([.E6])="YES");[.I6]>0);[.D6]+[.H6]+[.I6];"N/A") -> 8 | C6: Str | D6: of:=[$'Character Sheet'.$F$3] -> 6 | F6: Yes | G6: c | I6: 2 | J6: of:=[.I6]*IF(OR(UPPER([.G6])="C";UPPER([.G6])="Y");1;2) -> 2
A7: Concentration | B7: of:=IF(OR(NOT(UPPER([.E7])="YES");[.I7]>0);[.D7]+[.H7]+[.I7];"N/A") -> 3 | C7: Con | D7: of:=['Character Sheet'.$F$5] -> 3 | J7: of:=[.I7]*IF(OR(UPPER([.G7])="C";UPPER([.G7])="Y");1;2) -> 0
A8: Craft: Alchemy | B8: of:=IF(OR(NOT(UPPER([.E8])="YES");[.I8]>0);[.D8]+[.H8]+[.I8];"N/A") -> N/A | C8: Int | D8: of:=['Character Sheet'.$F$6] -> -1 | E8: Yes | G8: C | J8: of:=[.I8]*IF(OR(UPPER([.G8])="C";UPPER([.G8])="Y");1;2) -> 0
A9: Craft: Armorsmithing | B9: of:=IF(OR(NOT(UPPER([.E9])="YES");[.I9]>0);[.D9]+[.H9]+[.I9];"N/A") -> 0 | C9: Int | D9: of:=['Character Sheet'.$F$6] -> -1 | E9: Yes | G9: C | I9: 1 | J9: of:=[.I9]*IF(OR(UPPER([.G9])="C";UPPER([.G9])="Y");1;2) -> 1
A10: Craft: Blacksmithing | B10: of:=IF(OR(NOT(UPPER([.E10])="YES");[.I10]>0);[.D10]+[.H10]+[.I10];"N/A") -> 2 | C10: Int | D10: of:=['Character Sheet'.$F$6] -> -1 | E10: Yes | G10: C | I10: 3 | J10: of:=[.I10]*IF(OR(UPPER([.G10])="C";UPPER([.G10])="Y");1;2) -> 3
A11: Craft: Bowyer/Fletcher | B11: of:=IF(OR(NOT(UPPER([.E11])="YES");[.I11]>0);[.D11]+[.H11]+[.I11];"N/A") -> N/A | C11: Int | D11: of:=['Character Sheet'.$F$6] -> -1 | E11: Yes | G11: C | J11: of:=[.I11]*IF(OR(UPPER([.G11])="C";UPPER([.G11])="Y");1;2) -> 0
A12: Craft: Carpentry | B12: of:=IF(OR(NOT(UPPER([.E12])="YES");[.I12]>0);[.D12]+[.H12]+[.I12];"N/A") -> N/A | C12: Int | D12: of:=['Character Sheet'.$F$6] -> -1 | E12: Yes | G12: C | J12: of:=[.I12]*IF(OR(UPPER([.G12])="C";UPPER([.G12])="Y");1;2) -> 0
A13: Craft: Cooking | B13: of:=IF(OR(NOT(UPPER([.E13])="YES");[.I13]>0);[.D13]+[.H13]+[.I13];"N/A") -> N/A | C13: Int | D13: of:=['Character Sheet'.$F$6] -> -1 | E13: Yes | G13: C | J13: of:=[.I13]*IF(OR(UPPER([.G13])="C";UPPER([.G13])="Y");1;2) -> 0
A14: Craft: Leatherworking | B14: of:=IF(OR(NOT(UPPER([.E14])="YES");[.I14]>0);[.D14]+[.H14]+[.I14];"N/A") -> N/A | C14: Int | D14: of:=['Character Sheet'.$F$6] -> -1 | E14: Yes | G14: C | J14: of:=[.I14]*IF(OR(UPPER([.G14])="C";UPPER([.G14])="Y");1;2) -> 0
A15: Craft: Masonry | B15: of:=IF(OR(NOT(UPPER([.E15])="YES");[.I15]>0);[.D15]+[.H15]+[.I15];"N/A") -> N/A | C15: Int | D15: of:=['Character Sheet'.$F$6] -> -1 | E15: Yes | G15: C | J15: of:=[.I15]*IF(OR(UPPER([.G15])="C";UPPER([.G15])="Y");1;2) -> 0
A16: Craft: Pottery | B16: of:=IF(OR(NOT(UPPER([.E16])="YES");[.I16]>0);[.D16]+[.H16]+[.I16];"N/A") -> N/A | C16: Int | D16: of:=['Character Sheet'.$F$6] -> -1 | E16: Yes | G16: C | J16: of:=[.I16]*IF(OR(UPPER([.G16])="C";UPPER([.G16])="Y");1;2) -> 0
A17: Craft: Sculpting | B17: of:=IF(OR(NOT(UPPER([.E17])="YES");[.I17]>0);[.D17]+[.H17]+[.I17];"N/A") -> N/A | C17: Int | D17: of:=['Character Sheet'.$F$6] -> -1 | E17: Yes | G17: C | J17: of:=[.I17]*IF(OR(UPPER([.G17])="C";UPPER([.G17])="Y");1;2) -> 0
A18: Craft: Sewing | B18: of:=IF(OR(NOT(UPPER([.E18])="YES");[.I18]>0);[.D18]+[.H18]+[.I18];"N/A") -> N/A | C18: Int | D18: of:=['Character Sheet'.$F$6] -> -1 | E18: Yes | G18: C | J18: of:=[.I18]*IF(OR(UPPER([.G18])="C";UPPER([.G18])="Y");1;2) -> 0
A19: Craft: Shipbuilding | B19: of:=IF(OR(NOT(UPPER([.E19])="YES");[.I19]>0);[.D19]+[.H19]+[.I19];"N/A") -> N/A | C19: Int | D19: of:=['Character Sheet'.$F$6] -> -1 | E19: Yes | G19: C | J19: of:=[.I19]*IF(OR(UPPER([.G19])="C";UPPER([.G19])="Y");1;2) -> 0
A20: Craft: Trapmaking | B20: of:=IF(OR(NOT(UPPER([.E20])="YES");[.I20]>0);[.D20]+[.H20]+[.I20];"N/A") -> N/A | C20: Int | D20: of:=['Character Sheet'.$F$6] -> -1 | E20: Yes | G20: C | J20: of:=[.I20]*IF(OR(UPPER([.G20])="C";UPPER([.G20])="Y");1;2) -> 0
A21: Craft: Weaponsmithing | B21: of:=IF(OR(NOT(UPPER([.E21])="YES");[.I21]>0);[.D21]+[.H21]+[.I21];"N/A") -> N/A | C21: Int | D21: of:=['Character Sheet'.$F$6] -> -1 | E21: Yes | G21: C | J21: of:=[.I21]*IF(OR(UPPER([.G21])="C";UPPER([.G21])="Y");1;2) -> 0
A22: Decipher Script | B22: of:=IF(OR(NOT(UPPER([.E22])="YES");[.I22]>0);[.D22]+[.H22]+[.I22];"N/A") -> N/A | C22: Int | D22: of:=['Character Sheet'.$F$6] -> -1 | E22: Yes | J22: of:=[.I22]*IF(OR(UPPER([.G22])="C";UPPER([.G22])="Y");1;2) -> 0
A23: Diplomacy | B23: of:=IF(OR(NOT(UPPER([.E23])="YES");[.I23]>0);[.D23]+[.H23]+[.I23];"N/A") -> 0 | C23: Cha | D23: of:=['Character Sheet'.$F$8] -> 0 | J23: of:=[.I23]*IF(OR(UPPER([.G23])="C";UPPER([.G23])="Y");1;2) -> 0
A24: Disable Device | B24: of:=IF(OR(NOT(UPPER([.E24])="YES");[.I24]>0);[.D24]+[.H24]+[.I24];"N/A") -> N/A | C24: Int | D24: of:=['Character Sheet'.$F$6] -> -1 | E24: Yes | J24: of:=[.I24]*IF(OR(UPPER([.G24])="C";UPPER([.G24])="Y");1;2) -> 0
A25: Disguise | B25: of:=IF(OR(NOT(UPPER([.E25])="YES");[.I25]>0);[.D25]+[.H25]+[.I25];"N/A") -> 0 | C25: Cha | D25: of:=['Character Sheet'.$F$8] -> 0 | J25: of:=[.I25]*IF(OR(UPPER([.G25])="C";UPPER([.G25])="Y");1;2) -> 0
A26: Escape Artist | B26: of:=IF(OR(NOT(UPPER([.E26])="YES");[.I26]>0);[.D26]+[.H26]+[.I26];"N/A") -> 0 | C26: Dex | D26: of:=['Character Sheet'.$F$4] -> 0 | F26: Yes | J26: of:=[.I26]*IF(OR(UPPER([.G26])="C";UPPER([.G26])="Y");1;2) -> 0
A27: Forgery | B27: of:=IF(OR(NOT(UPPER([.E27])="YES");[.I27]>0);[.D27]+[.H27]+[.I27];"N/A") -> -1 | C27: Int | D27: of:=['Character Sheet'.$F$6] -> -1 | J27: of:=[.I27]*IF(OR(UPPER([.G27])="C";UPPER([.G27])="Y");1;2) -> 0
A28: Gather Information | B28: of:=IF(OR(NOT(UPPER([.E28])="YES");[.I28]>0);[.D28]+[.H28]+[.I28];"N/A") -> 0 | C28: Cha | D28: of:=['Character Sheet'.$F$8] -> 0 | J28: of:=[.I28]*IF(OR(UPPER([.G28])="C";UPPER([.G28])="Y");1;2) -> 0
A29: Handle Animal | B29: of:=IF(OR(NOT(UPPER([.E29])="YES");[.I29]>0);[.D29]+[.H29]+[.I29];"N/A") -> N/A | C29: Cha | D29: of:=['Character Sheet'.$F$8] -> 0 | E29: Yes | J29: of:=[.I29]*IF(OR(UPPER([.G29])="C";UPPER([.G29])="Y");1;2) -> 0
A30: Heal | B30: of:=IF(OR(NOT(UPPER([.E30])="YES");[.I30]>0);[.D30]+[.H30]+[.I30];"N/A") -> -1 | C30: Wis | D30: of:=['Character Sheet'.$F$7] -> -1 | J30: of:=[.I30]*IF(OR(UPPER([.G30])="C";UPPER([.G30])="Y");1;2) -> 0
A31: Hide | B31: of:=IF(OR(NOT(UPPER([.E31])="YES");[.I31]>0);[.D31]+[.H31]+[.I31];"N/A") -> 0 | C31: Dex | D31: of:=['Character Sheet'.$F$4] -> 0 | F31: Yes | J31: of:=[.I31]*IF(OR(UPPER([.G31])="C";UPPER([.G31])="Y");1;2) -> 0
A32: Intimidate | B32: of:=IF(OR(NOT(UPPER([.E32])="YES");[.I32]>0);[.D32]+[.H32]+[.I32];"N/A") -> 0 | C32: Cha | D32: of:=['Character Sheet'.$F$8] -> 0 | J32: of:=[.I32]*IF(OR(UPPER([.G32])="C";UPPER([.G32])="Y");1;2) -> 0
A33: Jump | B33: of:=IF(OR(NOT(UPPER([.E33])="YES");[.I33]>0);[.D33]+[.H33]+[.I33];"N/A") -> 8 | C33: Str | D33: of:=['Character Sheet'.$F$3] -> 6 | F33: Yes | G33: c | I33: 2 | J33: of:=[.I33]*IF(OR(UPPER([.G33])="C";UPPER([.G33])="Y");1;2) -> 2
A34: Knowledge: Arcana | B34: of:=IF(OR(NOT(UPPER([.E34])="YES");[.I34]>0);[.D34]+[.H34]+[.I34];"N/A") -> N/A | C34: Int | D34: of:=['Character Sheet'.$F$6] -> -1 | E34: Yes | J34: of:=[.I34]*IF(OR(UPPER([.G34])="C";UPPER([.G34])="Y");1;2) -> 0
A35: Knowledge: Architecture and engineering | B35: of:=IF(OR(NOT(UPPER([.E35])="YES");[.I35]>0);[.D35]+[.H35]+[.I35];"N/A") -> N/A | C35: Int | D35: of:=['Character Sheet'.$F$6] -> -1 | E35: Yes | J35: of:=[.I35]*IF(OR(UPPER([.G35])="C";UPPER([.G35])="Y");1;2) -> 0
A36: Knowledge: Dungeoneering | B36: of:=IF(OR(NOT(UPPER([.E36])="YES");[.I36]>0);[.D36]+[.H36]+[.I36];"N/A") -> N/A | C36: Int | D36: of:=['Character Sheet'.$F$6] -> -1 | E36: Yes | J36: of:=[.I36]*IF(OR(UPPER([.G36])="C";UPPER([.G36])="Y");1;2) -> 0
A37: Knowledge: Geography | B37: of:=IF(OR(NOT(UPPER([.E37])="YES");[.I37]>0);[.D37]+[.H37]+[.I37];"N/A") -> N/A | C37: Int | D37: of:=['Character Sheet'.$F$6] -> -1 | E37: Yes | J37: of:=[.I37]*IF(OR(UPPER([.G37])="C";UPPER([.G37])="Y");1;2) -> 0
A38: Knowledge: History | B38: of:=IF(OR(NOT(UPPER([.E38])="YES");[.I38]>0);[.D38]+[.H38]+[.I38];"N/A") -> N/A | C38: Int | D38: of:=['Character Sheet'.$F$6] -> -1 | E38: Yes | J38: of:=[.I38]*IF(OR(UPPER([.G38])="C";UPPER([.G38])="Y");1;2) -> 0
A39: Knowledge: Local | B39: of:=IF(OR(NOT(UPPER([.E39])="YES");[.I39]>0);[.D39]+[.H39]+[.I39];"N/A") -> N/A | C39: Int | D39: of:=['Character Sheet'.$F$6] -> -1 | E39: Yes | J39: of:=[.I39]*IF(OR(UPPER([.G39])="C";UPPER([.G39])="Y");1;2) -> 0
A40: Knowledge: Nature | B40: of:=IF(OR(NOT(UPPER([.E40])="YES");[.I40]>0);[.D40]+[.H40]+[.I40];"N/A") -> N/A | C40: Int | D40: of:=['Character Sheet'.$F$6] -> -1 | E40: Yes | J40: of:=[.I40]*IF(OR(UPPER([.G40])="C";UPPER([.G40])="Y");1;2) -> 0
A41: Knowledge: Nobility and royalty | B41: of:=IF(OR(NOT(UPPER([.E41])="YES");[.I41]>0);[.D41]+[.H41]+[.I41];"N/A") -> N/A | C41: Int | D41: of:=['Character Sheet'.$F$6] -> -1 | E41: Yes | J41: of:=[.I41]*IF(OR(UPPER([.G41])="C";UPPER([.G41])="Y");1;2) -> 0
A42: Knowledge: Religion | B42: of:=IF(OR(NOT(UPPER([.E42])="YES");[.I42]>0);[.D42]+[.H42]+[.I42];"N/A") -> N/A | C42: Int | D42: of:=['Character Sheet'.$F$6] -> -1 | E42: Yes | J42: of:=[.I42]*IF(OR(UPPER([.G42])="C";UPPER([.G42])="Y");1;2) -> 0
A43: Knowledge: The Planes | B43: of:=IF(OR(NOT(UPPER([.E43])="YES");[.I43]>0);[.D43]+[.H43]+[.I43];"N/A") -> N/A | C43: Int | D43: of:=['Character Sheet'.$F$6] -> -1 | E43: Yes | J43: of:=[.I43]*IF(OR(UPPER([.G43])="C";UPPER([.G43])="Y");1;2) -> 0
A44: Listen | B44: of:=IF(OR(NOT(UPPER([.E44])="YES");[.I44]>0);[.D44]+[.H44]+[.I44];"N/A") -> -1 | C44: Wis | D44: of:=['Character Sheet'.$F$7] -> -1 | J44: of:=[.I44]*IF(OR(UPPER([.G44])="C";UPPER([.G44])="Y");1;2) -> 0
A45: Move Silently | B45: of:=IF(OR(NOT(UPPER([.E45])="YES");[.I45]>0);[.D45]+[.H45]+[.I45];"N/A") -> 0 | C45: Dex | D45: of:=['Character Sheet'.$F$4] -> 0 | F45: Yes | J45: of:=[.I45]*IF(OR(UPPER([.G45])="C";UPPER([.G45])="Y");1;2) -> 0
A46: Open Lock | B46: of:=IF(OR(NOT(UPPER([.E46])="YES");[.I46]>0);[.D46]+[.H46]+[.I46];"N/A") -> N/A | C46: Dex | D46: of:=['Character Sheet'.$F$4] -> 0 | E46: Yes | J46: of:=[.I46]*IF(OR(UPPER([.G46])="C";UPPER([.G46])="Y");1;2) -> 0
A47: Perform | B47: of:=IF(OR(NOT(UPPER([.E47])="YES");[.I47]>0);[.D47]+[.H47]+[.I47];"N/A") -> 0 | C47: Cha | D47: of:=['Character Sheet'.$F$8] -> 0 | J47: of:=[.I47]*IF(OR(UPPER([.G47])="C";UPPER([.G47])="Y");1;2) -> 0
A48: Profession: | B48: of:=IF(OR(NOT(UPPER([.E48])="YES");[.I48]>0);[.D48]+[.H48]+[.I48];"N/A") -> N/A | C48: Wis | D48: of:=['Character Sheet'.$F$7] -> -1 | E48: Yes | G48: C | I48: 0 | J48: of:=[.I48]*IF(OR(UPPER([.G48])="C";UPPER([.G48])="Y");1;2) -> 0
A49: Profession: | B49: of:=IF(OR(NOT(UPPER([.E49])="YES");[.I49]>0);[.D49]+[.H49]+[.I49];"N/A") -> N/A | C49: Wis | D49: of:=['Character Sheet'.$F$7] -> -1 | E49: Yes | G49: C | J49: of:=[.I49]*IF(OR(UPPER([.G49])="C";UPPER([.G49])="Y");1;2) -> 0
A50: Profession: | B50: of:=IF(OR(NOT(UPPER([.E50])="YES");[.I50]>0);[.D50]+[.H50]+[.I50];"N/A") -> N/A | C50: Wis | D50: of:=['Character Sheet'.$F$7] -> -1 | E50: Yes | G50: C | J50: of:=[.I50]*IF(OR(UPPER([.G50])="C";UPPER([.G50])="Y");1;2) -> 0
A51: Ride | B51: of:=IF(OR(NOT(UPPER([.E51])="YES");[.I51]>0);[.D51]+[.H51]+[.I51];"N/A") -> 1 | C51: Dex | D51: of:=['Character Sheet'.$F$4] -> 0 | I51: 1 | J51: of:=[.I51]*IF(OR(UPPER([.G51])="C";UPPER([.G51])="Y");1;2) -> 2
A52: Search | B52: of:=IF(OR(NOT(UPPER([.E52])="YES");[.I52]>0);[.D52]+[.H52]+[.I52];"N/A") -> -1 | C52: Int | D52: of:=['Character Sheet'.$F$6] -> -1 | J52: of:=[.I52]*IF(OR(UPPER([.G52])="C";UPPER([.G52])="Y");1;2) -> 0
A53: Sense Motive | B53: of:=IF(OR(NOT(UPPER([.E53])="YES");[.I53]>0);[.D53]+[.H53]+[.I53];"N/A") -> -1 | C53: Wis | D53: of:=['Character Sheet'.$F$7] -> -1 | J53: of:=[.I53]*IF(OR(UPPER([.G53])="C";UPPER([.G53])="Y");1;2) -> 0
A54: Sleight Of Hand | B54: of:=IF(OR(NOT(UPPER([.E54])="YES");[.I54]>0);[.D54]+[.H54]+[.I54];"N/A") -> N/A | C54: Dex | D54: of:=['Character Sheet'.$F$4] -> 0 | E54: Yes | F54: Yes | J54: of:=[.I54]*IF(OR(UPPER([.G54])="C";UPPER([.G54])="Y");1;2) -> 0
A55: Speak Language | B55: of:=IF(OR(NOT(UPPER([.E55])="YES");[.I55]>0);[.D55]+[.H55]+[.I55];"N/A") -> -1 | C55: Int | D55: of:=['Character Sheet'.$F$6] -> -1 | G55: C | J55: of:=[.I55]*IF(OR(UPPER([.G55])="C";UPPER([.G55])="Y");1;2) -> 0
A56: Spellcraft | B56: of:=IF(OR(NOT(UPPER([.E56])="YES");[.I56]>0);[.D56]+[.H56]+[.I56];"N/A") -> -1 | C56: Int | D56: of:=['Character Sheet'.$F$6] -> -1 | J56: of:=[.I56]*IF(OR(UPPER([.G56])="C";UPPER([.G56])="Y");1;2) -> 0
A57: Spot | B57: of:=IF(OR(NOT(UPPER([.E57])="YES");[.I57]>0);[.D57]+[.H57]+[.I57];"N/A") -> -1 | C57: Wis | D57: of:=['Character Sheet'.$F$7] -> -1 | J57: of:=[.I57]*IF(OR(UPPER([.G57])="C";UPPER([.G57])="Y");1;2) -> 0
A58: Survival | B58: of:=IF(OR(NOT(UPPER([.E58])="YES");[.I58]>0);[.D58]+[.H58]+[.I58];"N/A") -> -1 | C58: Wis | D58: of:=['Character Sheet'.$F$7] -> -1 | J58: of:=[.I58]*IF(OR(UPPER([.G58])="C";UPPER([.G58])="Y");1;2) -> 0
A59: Swim | B59: of:=IF(OR(NOT(UPPER([.E59])="YES");[.I59]>0);[.D59]+[.H59]+[.I59];"N/A") -> 8 | C59: Str | D59: of:=['Character Sheet'.$F$3] -> 6 | F59: Yes | G59: c | I59: 2 | J59: of:=[.I59]*IF(OR(UPPER([.G59])="C";UPPER([.G59])="Y");1;2) -> 2
A60: Tumble | B60: of:=IF(OR(NOT(UPPER([.E60])="YES");[.I60]>0);[.D60]+[.H60]+[.I60];"N/A") -> N/A | C60: Dex | D60: of:=['Character Sheet'.$F$4] -> 0 | E60: Yes | F60: Yes | J60: of:=[.I60]*IF(OR(UPPER([.G60])="C";UPPER([.G60])="Y");1;2) -> 0
A61: Use Magic Device | B61: of:=IF(OR(NOT(UPPER([.E61])="YES");[.I61]>0);[.D61]+[.H61]+[.I61];"N/A") -> N/A | C61: Cha | D61: of:=['Character Sheet'.$F$8] -> 0 | E61: Yes | J61: of:=[.I61]*IF(OR(UPPER([.G61])="C";UPPER([.G61])="Y");1;2) -> 0
A62: Use Rope | B62: of:=IF(OR(NOT(UPPER([.E62])="YES");[.I62]>0);[.D62]+[.H62]+[.I62];"N/A") -> 0 | C62: Dex | D62: of:=['Character Sheet'.$F$4] -> 0 | J62: of:=[.I62]*IF(OR(UPPER([.G62])="C";UPPER([.G62])="Y");1;2) -> 0

Sheet: Spells
A1: Caster Level | B1: of:=MIN([.$D$1];[$'Character Sheet'.$L$4]) -> 0 | C1: Arcane Caster Feats | D1: of:=[$Feats.$B$2] -> 0 | E1: Extra Spells | F1: of:=MAX(0;2*([.$D$1]-MIN(19;[.$B$1]))) -> 0
A3: Spell Level | B3: 0 | C3: 1 | D3: 2 | E3: 3 | F3: 4 | G3: 5 | H3: 6 | I3: 7 | J3: 8 | K3: 9
A4: Save DC | B4: of:=INT(10+1.5*[.B$3]+[$'Character Sheet'.$F$8]) -> 10 | C4: of:=INT(10+1.5*[.C$3]+[$'Character Sheet'.$F$8]) -> 11 | D4: of:=INT(10+1.5*[.D$3]+[$'Character Sheet'.$F$8]) -> 13 | E4: of:=INT(10+1.5*[.E$3]+[$'Character Sheet'.$F$8]) -> 14 | F4: of:=INT(10+1.5*[.F$3]+[$'Character Sheet'.$F$8]) -> 16 | G4: of:=INT(10+1.5*[.G$3]+[$'Character Sheet'.$F$8]) -> 17 | H4: of:=INT(10+1.5*[.H$3]+[$'Character Sheet'.$F$8]) -> 19 | I4: of:=INT(10+1.5*[.I$3]+[$'Character Sheet'.$F$8]) -> 20 | J4: of:=INT(10+1.5*[.J$3]+[$'Character Sheet'.$F$8]) -> 22 | K4: of:=INT(10+1.5*[.K$3]+[$'Character Sheet'.$F$8]) -> 23
A5: Min SP | B5: 0 | C5: of:=[.C$3]*2+(2*[.C$3]-1)-1 -> 2 | D5: of:=[.D$3]*2+(2*[.D$3]-1)-1 -> 6 | E5: of:=[.E$3]*2+(2*[.E$3]-1)-1 -> 10 | F5: of:=[.F$3]*2+(2*[.F$3]-1)-1 -> 14 | G5: of:=[.G$3]*2+(2*[.G$3]-1)-1 -> 18 | H5: of:=[.H$3]*2+(2*[.H$3]-1)-1 -> 22 | I5: of:=[.I$3]*2+(2*[.I$3]-1)-1 -> 26 | J5: of:=[.J$3]*2+(2*[.J$3]-1)-1 -> 30 | K5: of:=[.K$3]*2+(2*[.K$3]-1)-1 -> 34
A6: Max SP | B6: 0 | C6: of:=IF([.C7]>0;2*[.C$3]+[.$B$1]-1;"N/A") -> N/A | D6: of:=IF([.D7]>0;2*[.D$3]+[.$B$1]-1;"N/A") -> N/A | E6: of:=IF([.E7]>0;2*[.E$3]+[.$B$1]-1;"N/A") -> N/A | F6: of:=IF([.F7]>0;2*[.F$3]+[.$B$1]-1;"N/A") -> N/A | G6: of:=IF([.G7]>0;2*[.G$3]+[.$B$1]-1;"N/A") -> N/A | H6: of:=IF([.H7]>0;2*[.H$3]+[.$B$1]-1;"N/A") -> N/A | I6: of:=IF([.I7]>0;2*[.I$3]+[.$B$1]-1;"N/A") -> N/A | J6: of:=IF([.J7]>0;2*[.J$3]+[.$B$1]-1;"N/A") -> N/A | K6: of:=IF([.K7]>0;2*[.K$3]+[.$B$1]-1;"N/A") -> N/A
A7: Spells Known | B7: of:=IF([.$D$1]<1;0;INT(([.$D$1]-1)/2+4)+IF([$'Character Sheet'.$F$6]>=[.B$3];1;0)) -> 0 | C7: of:=IF([.$B$1]<([.C$3]*2);0;IF([.$B$1]=([.C$3]*2);2;IF([.$B$1]=([.C$3]*2)+1; 4;IF([$'Character Sheet'.$F$6]>=[.C$3];5;4)))) -> 0 | D7: of:=IF([.$B$1]<([.D$3]*2);0;IF([.$B$1]=([.D$3]*2);2;IF([.$B$1]=([.D$3]*2)+1; 4;IF([$'Character Sheet'.$F$6]>=[.D$3];5;4)))) -> 0 | E7: of:=IF([.$B$1]<([.E$3]*2);0;IF([.$B$1]=([.E$3]*2);2;IF([.$B$1]=([.E$3]*2)+1; 4;IF([$'Character Sheet'.$F$6]>=[.E$3];5;4)))) -> 0 | F7: of:=IF([.$B$1]<([.F$3]*2);0;IF([.$B$1]=([.F$3]*2);2;IF([.$B$1]=([.F$3]*2)+1; 4;IF([$'Character Sheet'.$F$6]>=[.F$3];5;4)))) -> 0 | G7: of:=IF([.$B$1]<([.G$3]*2);0;IF([.$B$1]=([.G$3]*2);2;IF([.$B$1]=([.G$3]*2)+1; 4;IF([$'Character Sheet'.$F$6]>=[.G$3];5;4)))) -> 0 | H7: of:=IF([.$B$1]<([.H$3]*2);0;IF([.$B$1]=([.H$3]*2);2;IF([.$B$1]=([.H$3]*2)+1; 4;IF([$'Character Sheet'.$F$6]>=[.H$3];5;4)))) -> 0 | I7: of:=IF([.$B$1]<([.I$3]*2);0;IF([.$B$1]=([.I$3]*2);2;IF([.$B$1]=([.I$3]*2)+1; 4;IF([$'Character Sheet'.$F$6]>=[.I$3];5;4)))) -> 0 | J7: of:=IF([.$B$1]<([.J$3]*2);0;IF([.$B$1]=([.J$3]*2);2;IF([.$B$1]=([.J$3]*2)+1; 4;IF([$'Character Sheet'.$F$6]>=[.J$3];5;4)))) -> 0 | K7: of:=IF([.$B$1]<([.K$3]*2);0;IF([.$B$1]=([.K$3]*2);2;IF([.$B$1]=([.K$3]*2)+1; 4;IF([$'Character Sheet'.$F$6]>=[.K$3];5;4)))) -> 0
A8: 1
A9: 2
A10: 3
A11: 4
A12: 5
A13: 6
A14: 7
A15: 8
A16: 9
A17: 10
A18: 11
A19: 12
A20: 13
A21: 14
A22: 15
A23: 16
A24: 17
A25: 18
A26: 19
A27: 20

Sheet: Equipment
A1: Qty | B1: Item | C1: Gold Weight | D1: Cost
A2: 750 | B2: Gold
B3: Traveler’s Outfit
B4: Backpack
B5: Bed Roll
B6: Blanket
B7: Flint/Steel
B8: Tent
B9: 50’ Silk Rope
B10: Sack
B11: Water Skin
B12: Rations: 8 days
B13: Lantern
B14: 9 flasks of Oil
B15: Dire Lion Hide Cloak of Resistance +1
B16: Potion of restoration: 2
B17: Aid Potion: 2
B18: Cure Light Wounds Potion: 4
B19: Type 1 Bag of Swords (holding)
B20: Potion of Bear’s Endurance
A21: 2 | B21: Potion of enlarge person
A22: 2 | B22: Potion of Cure Serious Wounds

Sheet: Level Table
B2: Lvl | C2: XP | D2: Class Skill Max | E2: X-Class Skill Max | F2: Bonus Feats | G2: Bonus Feats (Human) | H2: Stat Bonus | I2: Base BAB | J2: Base Save | K2: Base HP | L2: Base SP | M2: Base Feats | N2: Skill Points | O2: GP | P2: GP (Human) | Q2: Max Extra Feats | R2: Max Extra BAB | S2: Good Save | T2: Max Extra Save | U2: Max Extra HP | V2: Max Extra SP
B3: 1 | C3: 0 | D3: of:=[.B3]+3 -> 4 | E3: of:=INT([.D3]/2) -> 2 | F3: of:=INT(1+[.$B3]/3) -> 1 | G3: of:=INT(2+[.$B3]/3) -> 2 | H3: of:=INT([.B3]/4) -> 0 | I3: of:=INT([.B3]/2) -> 0 | J3: of:=INT([.B3]/3) -> 0 | K3: of:=[.$B3]*3 -> 3 | L3: of:=[.$B3]*3 -> 3 | M3: of:=[.$B3]-[.F3]+7 -> 7 | N3: of:=([.$B3]+3)*2 -> 8 | O3: of:=([.$B3]+3)*8 -> 32 | P3: of:=([.$B3]+3)*9 -> 36 | Q3: of:=INT([.P3]/5) -> 7 | R3: of:=[.B3]-[.I3] -> 1 | S3: of:=2+INT([.$B3]/2) -> 2 | T3: of:=[.S3]-[.J3] -> 2 | U3: of:=[.$B3]*9 -> 9 | V3: 3
B4: of:=[.B3]+1 -> 2 | C4: of:=[.B4]*[.B3]*500 -> 1000 | D4: of:=[.B4]+3 -> 5 | E4: of:=INT([.D4]/2) -> 2 | F4: of:=INT(1+[.$B4]/3) -> 1 | G4: of:=INT(2+[.$B4]/3) -> 2 | H4: of:=INT([.B4]/4) -> 0 | I4: of:=INT([.B4]/2) -> 1 | J4: of:=INT([.B4]/3) -> 0 | K4: of:=[.$B4]*3 -> 6 | L4: of:=[.$B4]*3 -> 6 | M4: of:=[.$B4]-[.F4]+7 -> 8 | N4: of:=([.$B4]+3)*2 -> 10 | O4: of:=([.$B4]+3)*8 -> 40 | P4: of:=([.$B4]+3)*9 -> 45 | Q4: of:=INT([.P4]/5) -> 9 | R4: of:=[.B4]-[.I4] -> 1 | S4: of:=2+INT([.$B4]/2) -> 3 | T4: of:=MAX([.T3];[.S4]-[.J4]) -> 3 | U4: of:=[.$B4]*9 -> 18 | V4: 6
B5: of:=[.B4]+1 -> 3 | C5: of:=[.B5]*[.B4]*500 -> 3000 | D5: of:=[.B5]+3 -> 6 | E5: of:=INT([.D5]/2) -> 3 | F5: of:=INT(1+[.$B5]/3) -> 2 | G5: of:=INT(2+[.$B5]/3) -> 3 | H5: of:=INT([.B5]/4) -> 0 | I5: of:=INT([.B5]/2) -> 1 | J5: of:=INT([.B5]/3) -> 1 | K5: of:=[.$B5]*3 -> 9 | L5: of:=[.$B5]*3 -> 9 | M5: of:=[.$B5]-[.F5]+7 -> 8 | N5: of:=([.$B5]+3)*2 -> 12 | O5: of:=([.$B5]+3)*8 -> 48 | P5: of:=([.$B5]+3)*9 -> 54 | Q5: of:=INT([.P5]/5) -> 10 | R5: of:=[.B5]-[.I5] -> 2 | S5: of:=2+INT([.$B5]/2) -> 3 | T5: of:=MAX([.T4];[.S5]-[.J5]) -> 3 | U5: of:=[.$B5]*9 -> 27 | V5: 12
B6: of:=[.B5]+1 -> 4 | C6: of:=[.B6]*[.B5]*500 -> 6000 | D6: of:=[.B6]+3 -> 7 | E6: of:=INT([.D6]/2) -> 3 | F6: of:=INT(1+[.$B6]/3) -> 2 | G6: of:=INT(2+[.$B6]/3) -> 3 | H6: of:=INT([.B6]/4) -> 1 | I6: of:=INT([.B6]/2) -> 2 | J6: of:=INT([.B6]/3) -> 1 | K6: of:=[.$B6]*3 -> 12 | L6: of:=[.$B6]*3 -> 12 | M6: of:=[.$B6]-[.F6]+7 -> 9 | N6: of:=([.$B6]+3)*2 -> 14 | O6: of:=([.$B6]+3)*8 -> 56 | P6: of:=([.$B6]+3)*9 -> 63 | Q6: of:=INT([.P6]/5) -> 12 | R6: of:=[.B6]-[.I6] -> 2 | S6: of:=2+INT([.$B6]/2) -> 4 | T6: of:=MAX([.T5];[.S6]-[.J6]) -> 3 | U6: of:=[.$B6]*9 -> 36 | V6: 39
B7: of:=[.B6]+1 -> 5 | C7: of:=[.B7]*[.B6]*500 -> 10000 | D7: of:=[.B7]+3 -> 8 | E7: of:=INT([.D7]/2) -> 4 | F7: of:=INT(1+[.$B7]/3) -> 2 | G7: of:=INT(2+[.$B7]/3) -> 3 | H7: of:=INT([.B7]/4) -> 1 | I7: of:=INT([.B7]/2) -> 2 | J7: of:=INT([.B7]/3) -> 1 | K7: of:=[.$B7]*3 -> 15 | L7: of:=[.$B7]*3 -> 15 | M7: of:=[.$B7]-[.F7]+7 -> 10 | N7: of:=([.$B7]+3)*2 -> 16 | O7: of:=([.$B7]+3)*8 -> 64 | P7: of:=([.$B7]+3)*9 -> 72 | Q7: of:=INT([.P7]/5) -> 14 | R7: of:=[.B7]-[.I7] -> 3 | S7: of:=2+INT([.$B7]/2) -> 4 | T7: of:=MAX([.T6];[.S7]-[.J7]) -> 3 | U7: of:=[.$B7]*9 -> 45 | V7: 54
B8: of:=[.B7]+1 -> 6 | C8: of:=[.B8]*[.B7]*500 -> 15000 | D8: of:=[.B8]+3 -> 9 | E8: of:=INT([.D8]/2) -> 4 | F8: of:=INT(1+[.$B8]/3) -> 3 | G8: of:=INT(2+[.$B8]/3) -> 4 | H8: of:=INT([.B8]/4) -> 1 | I8: of:=INT([.B8]/2) -> 3 | J8: of:=INT([.B8]/3) -> 2 | K8: of:=[.$B8]*3 -> 18 | L8: of:=[.$B8]*3 -> 18 | M8: of:=[.$B8]-[.F8]+7 -> 10 | N8: of:=([.$B8]+3)*2 -> 18 | O8: of:=([.$B8]+3)*8 -> 72 | P8: of:=([.$B8]+3)*9 -> 81 | Q8: of:=INT([.P8]/5) -> 16 | R8: of:=[.B8]-[.I8] -> 3 | S8: of:=2+INT([.$B8]/2) -> 5 | T8: of:=MAX([.T7];[.S8]-[.J8]) -> 3 | U8: of:=[.$B8]*9 -> 54 | V8: 102
B9: of:=[.B8]+1 -> 7 | C9: of:=[.B9]*[.B8]*500 -> 21000 | D9: of:=[.B9]+3 -> 10 | E9: of:=INT([.D9]/2) -> 5 | F9: of:=INT(1+[.$B9]/3) -> 3 | G9: of:=INT(2+[.$B9]/3) -> 4 | H9: of:=INT([.B9]/4) -> 1 | I9: of:=INT([.B9]/2) -> 3 | J9: of:=INT([.B9]/3) -> 2 | K9: of:=[.$B9]*3 -> 21 | L9: of:=[.$B9]*3 -> 21 | M9: of:=[.$B9]-[.F9]+7 -> 11 | N9: of:=([.$B9]+3)*2 -> 20 | O9: of:=([.$B9]+3)*8 -> 80 | P9: of:=([.$B9]+3)*9 -> 90 | Q9: of:=INT([.P9]/5) -> 18 | R9: of:=[.B9]-[.I9] -> 4 | S9: of:=2+INT([.$B9]/2) -> 5 | T9: of:=MAX([.T8];[.S9]-[.J9]) -> 3 | U9: of:=[.$B9]*9 -> 63 | V9: 144
B10: of:=[.B9]+1 -> 8 | C10: of:=[.B10]*[.B9]*500 -> 28000 | D10: of:=[.B10]+3 -> 11 | E10: of:=INT([.D10]/2) -> 5 | F10: of:=INT(1+[.$B10]/3) -> 3 | G10: of:=INT(2+[.$B10]/3) -> 4 | H10: of:=INT([.B10]/4) -> 2 | I10: of:=INT([.B10]/2) -> 4 | J10: of:=INT([.B10]/3) -> 2 | K10: of:=[.$B10]*3 -> 24 | L10: of:=[.$B10]*3 -> 24 | M10: of:=[.$B10]-[.F10]+7 -> 12 | N10: of:=([.$B10]+3)*2 -> 22 | O10: of:=([.$B10]+3)*8 -> 88 | P10: of:=([.$B10]+3)*9 -> 99 | Q10: of:=INT([.P10]/5) -> 19 | R10: of:=[.B10]-[.I10] -> 4 | S10: of:=2+INT([.$B10]/2) -> 6 | T10: of:=MAX([.T9];[.S10]-[.J10]) -> 4 | U10: of:=[.$B10]*9 -> 72 | V10: 207
B11: of:=[.B10]+1 -> 9 | C11: of:=[.B11]*[.B10]*500 -> 36000 | D11: of:=[.B11]+3 -> 12 | E11: of:=INT([.D11]/2) -> 6 | F11: of:=INT(1+[.$B11]/3) -> 4 | G11: of:=INT(2+[.$B11]/3) -> 5 | H11: of:=INT([.B11]/4) -> 2 | I11: of:=INT([.B11]/2) -> 4 | J11: of:=INT([.B11]/3) -> 3 | K11: of:=[.$B11]*3 -> 27 | L11: of:=[.$B11]*3 -> 27 | M11: of:=[.$B11]-[.F11]+7 -> 12 | N11: of:=([.$B11]+3)*2 -> 24 | O11: of:=([.$B11]+3)*8 -> 96 | P11: of:=([.$B11]+3)*9 -> 108 | Q11: of:=INT([.P11]/5) -> 21 | R11: of:=[.B11]-[.I11] -> 5 | S11: of:=2+INT([.$B11]/2) -> 6 | T11: of:=MAX([.T10];[.S11]-[.J11]) -> 4 | U11: of:=[.$B11]*9 -> 81 | V11: 252
B12: of:=[.B11]+1 -> 10 | C12: of:=[.B12]*[.B11]*500 -> 45000 | D12: of:=[.B12]+3 -> 13 | E12: of:=INT([.D12]/2) -> 6 | F12: of:=INT(1+[.$B12]/3) -> 4 | G12: of:=INT(2+[.$B12]/3) -> 5 | H12: of:=INT([.B12]/4) -> 2 | I12: of:=INT([.B12]/2) -> 5 | J12: of:=INT([.B12]/3) -> 3 | K12: of:=[.$B12]*3 -> 30 | L12: of:=[.$B12]*3 -> 30 | M12: of:=[.$B12]-[.F12]+7 -> 13 | N12: of:=([.$B12]+3)*2 -> 26 | O12: of:=([.$B12]+3)*8 -> 104 | P12: of:=([.$B12]+3)*9 -> 117 | Q12: of:=INT([.P12]/5) -> 23 | R12: of:=[.B12]-[.I12] -> 5 | S12: of:=2+INT([.$B12]/2) -> 7 | T12: of:=MAX([.T11];[.S12]-[.J12]) -> 4 | U12: of:=[.$B12]*9 -> 90 | V12: 999999
B13: of:=[.B12]+1 -> 11 | C13: of:=[.B13]*[.B12]*500 -> 55000 | D13: of:=[.B13]+3 -> 14 | E13: of:=INT([.D13]/2) -> 7 | F13: of:=INT(1+[.$B13]/3) -> 4 | G13: of:=INT(2+[.$B13]/3) -> 5 | H13: of:=INT([.B13]/4) -> 2 | I13: of:=INT([.B13]/2) -> 5 | J13: of:=INT([.B13]/3) -> 3 | K13: of:=[.$B13]*3 -> 33 | L13: of:=[.$B13]*3 -> 33 | M13: of:=[.$B13]-[.F13]+7 -> 14 | N13: of:=([.$B13]+3)*2 -> 28 | O13: of:=([.$B13]+3)*8 -> 112 | P13: of:=([.$B13]+3)*9 -> 126 | Q13: of:=INT([.P13]/5) -> 25 | R13: of:=[.B13]-[.I13] -> 6 | S13: of:=2+INT([.$B13]/2) -> 7 | T13: of:=MAX([.T12];[.S13]-[.J13]) -> 4 | U13: of:=[.$B13]*9 -> 99 | V13: 999999
B14: of:=[.B13]+1 -> 12 | C14: of:=[.B14]*[.B13]*500 -> 66000 | D14: of:=[.B14]+3 -> 15 | E14: of:=INT([.D14]/2) -> 7 | F14: of:=INT(1+[.$B14]/3) -> 5 | G14: of:=INT(2+[.$B14]/3) -> 6 | H14: of:=INT([.B14]/4) -> 3 | I14: of:=INT([.B14]/2) -> 6 | J14: of:=INT([.B14]/3) -> 4 | K14: of:=[.$B14]*3 -> 36 | L14: of:=[.$B14]*3 -> 36 | M14: of:=[.$B14]-[.F14]+7 -> 14 | N14: of:=([.$B14]+3)*2 -> 30 | O14: of:=([.$B14]+3)*8 -> 120 | P14: of:=([.$B14]+3)*9 -> 135 | Q14: of:=INT([.P14]/5) -> 27 | R14: of:=[.B14]-[.I14] -> 6 | S14: of:=2+INT([.$B14]/2) -> 8 | T14: of:=MAX([.T13];[.S14]-[.J14]) -> 4 | U14: of:=[.$B14]*9 -> 108 | V14: 999999
B15: of:=[.B14]+1 -> 13 | C15: of:=[.B15]*[.B14]*500 -> 78000 | D15: of:=[.B15]+3 -> 16 | E15: of:=INT([.D15]/2) -> 8 | F15: of:=INT(1+[.$B15]/3) -> 5 | G15: of:=INT(2+[.$B15]/3) -> 6 | H15: of:=INT([.B15]/4) -> 3 | I15: of:=INT([.B15]/2) -> 6 | J15: of:=INT([.B15]/3) -> 4 | K15: of:=[.$B15]*3 -> 39 | L15: of:=[.$B15]*3 -> 39 | M15: of:=[.$B15]-[.F15]+7 -> 15 | N15: of:=([.$B15]+3)*2 -> 32 | O15: of:=([.$B15]+3)*8 -> 128 | P15: of:=([.$B15]+3)*9 -> 144 | Q15: of:=INT([.P15]/5) -> 28 | R15: of:=[.B15]-[.I15] -> 7 | S15: of:=2+INT([.$B15]/2) -> 8 | T15: of:=MAX([.T14];[.S15]-[.J15]) -> 4 | U15: of:=[.$B15]*9 -> 117 | V15: 999999
B16: of:=[.B15]+1 -> 14 | C16: of:=[.B16]*[.B15]*500 -> 91000 | D16: of:=[.B16]+3 -> 17 | E16: of:=INT([.D16]/2) -> 8 | F16: of:=INT(1+[.$B16]/3) -> 5 | G16: of:=INT(2+[.$B16]/3) -> 6 | H16: of:=INT([.B16]/4) -> 3 | I16: of:=INT([.B16]/2) -> 7 | J16: of:=INT([.B16]/3) -> 4 | K16: of:=[.$B16]*3 -> 42 | L16: of:=[.$B16]*3 -> 42 | M16: of:=[.$B16]-[.F16]+7 -> 16 | N16: of:=([.$B16]+3)*2 -> 34 | O16: of:=([.$B16]+3)*8 -> 136 | P16: of:=([.$B16]+3)*9 -> 153 | Q16: of:=INT([.P16]/5) -> 30 | R16: of:=[.B16]-[.I16] -> 7 | S16: of:=2+INT([.$B16]/2) -> 9 | T16: of:=MAX([.T15];[.S16]-[.J16]) -> 5 | U16: of:=[.$B16]*9 -> 126 | V16: 999999
B17: of:=[.B16]+1 -> 15 | C17: of:=[.B17]*[.B16]*500 -> 105000 | D17: of:=[.B17]+3 -> 18 | E17: of:=INT([.D17]/2) -> 9 | F17: of:=INT(1+[.$B17]/3) -> 6 | G17: of:=INT(2+[.$B17]/3) -> 7 | H17: of:=INT([.B17]/4) -> 3 | I17: of:=INT([.B17]/2) -> 7 | J17: of:=INT([.B17]/3) -> 5 | K17: of:=[.$B17]*3 -> 45 | L17: of:=[.$B17]*3 -> 45 | M17: of:=[.$B17]-[.F17]+7 -> 16 | N17: of:=([.$B17]+3)*2 -> 36 | O17: of:=([.$B17]+3)*8 -> 144 | P17: of:=([.$B17]+3)*9 -> 162 | Q17: of:=INT([.P17]/5) -> 32 | R17: of:=[.B17]-[.I17] -> 8 | S17: of:=2+INT([.$B17]/2) -> 9 | T17: of:=MAX([.T16];[.S17]-[.J17]) -> 5 | U17: of:=[.$B17]*9 -> 135 | V17: 999999
B18: of:=[.B17]+1 -> 16 | C18: of:=[.B18]*[.B17]*500 -> 120000 | D18: of:=[.B18]+3 -> 19 | E18: of:=INT([.D18]/2) -> 9 | F18: of:=INT(1+[.$B18]/3) -> 6 | G18: of:=INT(2+[.$B18]/3) -> 7 | H18: of:=INT([.B18]/4) -> 4 | I18: of:=INT([.B18]/2) -> 8 | J18: of:=INT([.B18]/3) -> 5 | K18: of:=[.$B18]*3 -> 48 | L18: of:=[.$B18]*3 -> 48 | M18: of:=[.$B18]-[.F18]+7 -> 17 | N18: of:=([.$B18]+3)*2 -> 38 | O18: of:=([.$B18]+3)*8 -> 152 | P18: of:=([.$B18]+3)*9 -> 171 | Q18: of:=INT([.P18]/5) -> 34 | R18: of:=[.B18]-[.I18] -> 8 | S18: of:=2+INT([.$B18]/2) -> 10 | T18: of:=MAX([.T17];[.S18]-[.J18]) -> 5 | U18: of:=[.$B18]*9 -> 144 | V18: 999999
B19: of:=[.B18]+1 -> 17 | C19: of:=[.B19]*[.B18]*500 -> 136000 | D19: of:=[.B19]+3 -> 20 | E19: of:=INT([.D19]/2) -> 10 | F19: of:=INT(1+[.$B19]/3) -> 6 | G19: of:=INT(2+[.$B19]/3) -> 7 | H19: of:=INT([.B19]/4) -> 4 | I19: of:=INT([.B19]/2) -> 8 | J19: of:=INT([.B19]/3) -> 5 | K19: of:=[.$B19]*3 -> 51 | L19: of:=[.$B19]*3 -> 51 | M19: of:=[.$B19]-[.F19]+7 -> 18 | N19: of:=([.$B19]+3)*2 -> 40 | O19: of:=([.$B19]+3)*8 -> 160 | P19: of:=([.$B19]+3)*9 -> 180 | Q19: of:=INT([.P19]/5) -> 36 | R19: of:=[.B19]-[.I19] -> 9 | S19: of:=2+INT([.$B19]/2) -> 10 | T19: of:=MAX([.T18];[.S19]-[.J19]) -> 5 | U19: of:=[.$B19]*9 -> 153 | V19: 999999
B20: of:=[.B19]+1 -> 18 | C20: of:=[.B20]*[.B19]*500 -> 153000 | D20: of:=[.B20]+3 -> 21 | E20: of:=INT([.D20]/2) -> 10 | F20: of:=INT(1+[.$B20]/3) -> 7 | G20: of:=INT(2+[.$B20]/3) -> 8 | H20: of:=INT([.B20]/4) -> 4 | I20: of:=INT([.B20]/2) -> 9 | J20: of:=INT([.B20]/3) -> 6 | K20: of:=[.$B20]*3 -> 54 | L20: of:=[.$B20]*3 -> 54 | M20: of:=[.$B20]-[.F20]+7 -> 18 | N20: of:=([.$B20]+3)*2 -> 42 | O20: of:=([.$B20]+3)*8 -> 168 | P20: of:=([.$B20]+3)*9 -> 189 | Q20: of:=INT([.P20]/5) -> 37 | R20: of:=[.B20]-[.I20] -> 9 | S20: of:=2+INT([.$B20]/2) -> 11 | T20: of:=MAX([.T19];[.S20]-[.J20]) -> 5 | U20: of:=[.$B20]*9 -> 162 | V20: 999999
B21: of:=[.B20]+1 -> 19 | C21: of:=[.B21]*[.B20]*500 -> 171000 | D21: of:=[.B21]+3 -> 22 | E21: of:=INT([.D21]/2) -> 11 | F21: of:=INT(1+[.$B21]/3) -> 7 | G21: of:=INT(2+[.$B21]/3) -> 8 | H21: of:=INT([.B21]/4) -> 4 | I21: of:=INT([.B21]/2) -> 9 | J21: of:=INT([.B21]/3) -> 6 | K21: of:=[.$B21]*3 -> 57 | L21: of:=[.$B21]*3 -> 57 | M21: of:=[.$B21]-[.F21]+7 -> 19 | N21: of:=([.$B21]+3)*2 -> 44 | O21: of:=([.$B21]+3)*8 -> 176 | P21: of:=([.$B21]+3)*9 -> 198 | Q21: of:=INT([.P21]/5) -> 39 | R21: of:=[.B21]-[.I21] -> 10 | S21: of:=2+INT([.$B21]/2) -> 11 | T21: of:=MAX([.T20];[.S21]-[.J21]) -> 5 | U21: of:=[.$B21]*9 -> 171 | V21: 999999
B22: of:=[.B21]+1 -> 20 | C22: of:=[.B22]*[.B21]*500 -> 190000 | D22: of:=[.B22]+3 -> 23 | E22: of:=INT([.D22]/2) -> 11 | F22: of:=INT(1+[.$B22]/3) -> 7 | G22: of:=INT(2+[.$B22]/3) -> 8 | H22: of:=INT([.B22]/4) -> 5 | I22: of:=INT([.B22]/2) -> 10 | J22: of:=INT([.B22]/3) -> 6 | K22: of:=[.$B22]*3 -> 60 | L22: of:=[.$B22]*3 -> 60 | M22: of:=[.$B22]-[.F22]+7 -> 20 | N22: of:=([.$B22]+3)*2 -> 46 | O22: of:=([.$B22]+3)*8 -> 184 | P22: of:=([.$B22]+3)*9 -> 207 | Q22: of:=INT([.P22]/5) -> 41 | R22: of:=[.B22]-[.I22] -> 10 | S22: of:=2+INT([.$B22]/2) -> 12 | T22: of:=MAX([.T21];[.S22]-[.J22]) -> 6 | U22: of:=[.$B22]*9 -> 180 | V22: 999999
B23: of:=[.B22]+1 -> 21 | C23: of:=[.B23]*[.B22]*500 -> 210000 | D23: of:=[.B23]+3 -> 24 | E23: of:=INT([.D23]/2) -> 12 | F23: of:=INT(1+[.$B23]/3) -> 8 | G23: of:=INT(2+[.$B23]/3) -> 9 | H23: of:=INT([.B23]/4) -> 5 | I23: of:=INT([.B23]/2) -> 10 | J23: of:=INT([.B23]/3) -> 7 | K23: of:=[.$B23]*3 -> 63 | L23: of:=[.$B23]*3 -> 63 | M23: of:=[.$B23]-[.F23]+7 -> 20 | N23: of:=([.$B23]+3)*2 -> 48 | O23: of:=([.$B23]+3)*8 -> 192 | P23: of:=([.$B23]+3)*9 -> 216 | Q23: of:=INT([.P23]/5) -> 43 | R23: of:=[.B23]-[.I23] -> 11 | S23: of:=2+INT([.$B23]/2) -> 12 | T23: of:=MAX([.T22];[.S23]-[.J23]) -> 6 | U23: of:=[.$B23]*9 -> 189 | V23: 999999
B24: of:=[.B23]+1 -> 22 | C24: of:=[.B24]*[.B23]*500 -> 231000 | D24: of:=[.B24]+3 -> 25 | E24: of:=INT([.D24]/2) -> 12 | F24: of:=INT(1+[.$B24]/3) -> 8 | G24: of:=INT(2+[.$B24]/3) -> 9 | H24: of:=INT([.B24]/4) -> 5 | I24: of:=INT([.B24]/2) -> 11 | J24: of:=INT([.B24]/3) -> 7 | K24: of:=[.$B24]*3 -> 66 | L24: of:=[.$B24]*3 -> 66 | M24: of:=[.$B24]-[.F24]+7 -> 21 | N24: of:=([.$B24]+3)*2 -> 50 | O24: of:=([.$B24]+3)*8 -> 200 | P24: of:=([.$B24]+3)*9 -> 225 | Q24: of:=INT([.P24]/5) -> 45 | R24: of:=[.B24]-[.I24] -> 11 | S24: of:=2+INT([.$B24]/2) -> 13 | T24: of:=MAX([.T23];[.S24]-[.J24]) -> 6 | U24: of:=[.$B24]*9 -> 198 | V24: 999999
B25: of:=[.B24]+1 -> 23 | C25: of:=[.B25]*[.B24]*500 -> 253000 | D25: of:=[.B25]+3 -> 26 | E25: of:=INT([.D25]/2) -> 13 | F25: of:=INT(1+[.$B25]/3) -> 8 | G25: of:=INT(2+[.$B25]/3) -> 9 | H25: of:=INT([.B25]/4) -> 5 | I25: of:=INT([.B25]/2) -> 11 | J25: of:=INT([.B25]/3) -> 7 | K25: of:=[.$B25]*3 -> 69 | L25: of:=[.$B25]*3 -> 69 | M25: of:=[.$B25]-[.F25]+7 -> 22 | N25: of:=([.$B25]+3)*2 -> 52 | O25: of:=([.$B25]+3)*8 -> 208 | P25: of:=([.$B25]+3)*9 -> 234 | Q25: of:=INT([.P25]/5) -> 46 | R25: of:=[.B25]-[.I25] -> 12 | S25: of:=2+INT([.$B25]/2) -> 13 | T25: of:=MAX([.T24];[.S25]-[.J25]) -> 6 | U25: of:=[.$B25]*9 -> 207 | V25: 999999
B26: of:=[.B25]+1 -> 24 | C26: of:=[.B26]*[.B25]*500 -> 276000 | D26: of:=[.B26]+3 -> 27 | E26: of:=INT([.D26]/2) -> 13 | F26: of:=INT(1+[.$B26]/3) -> 9 | G26: of:=INT(2+[.$B26]/3) -> 10 | H26: of:=INT([.B26]/4) -> 6 | I26: of:=INT([.B26]/2) -> 12 | J26: of:=INT([.B26]/3) -> 8 | K26: of:=[.$B26]*3 -> 72 | L26: of:=[.$B26]*3 -> 72 | M26: of:=[.$B26]-[.F26]+7 -> 22 | N26: of:=([.$B26]+3)*2 -> 54 | O26: of:=([.$B26]+3)*8 -> 216 | P26: of:=([.$B26]+3)*9 -> 243 | Q26: of:=INT([.P26]/5) -> 48 | R26: of:=[.B26]-[.I26] -> 12 | S26: of:=2+INT([.$B26]/2) -> 14 | T26: of:=MAX([.T25];[.S26]-[.J26]) -> 6 | U26: of:=[.$B26]*9 -> 216 | V26: 999999
B27: of:=[.B26]+1 -> 25 | C27: of:=[.B27]*[.B26]*500 -> 300000 | D27: of:=[.B27]+3 -> 28 | E27: of:=INT([.D27]/2) -> 14 | F27: of:=INT(1+[.$B27]/3) -> 9 | G27: of:=INT(2+[.$B27]/3) -> 10 | H27: of:=INT([.B27]/4) -> 6 | I27: of:=INT([.B27]/2) -> 12 | J27: of:=INT([.B27]/3) -> 8 | K27: of:=[.$B27]*3 -> 75 | L27: of:=[.$B27]*3 -> 75 | M27: of:=[.$B27]-[.F27]+7 -> 23 | N27: of:=([.$B27]+3)*2 -> 56 | O27: of:=([.$B27]+3)*8 -> 224 | P27: of:=([.$B27]+3)*9 -> 252 | Q27: of:=INT([.P27]/5) -> 50 | R27: of:=[.B27]-[.I27] -> 13 | S27: of:=2+INT([.$B27]/2) -> 14 | T27: of:=MAX([.T26];[.S27]-[.J27]) -> 6 | U27: of:=[.$B27]*9 -> 225 | V27: 999999
B28: of:=[.B27]+1 -> 26 | C28: of:=[.B28]*[.B27]*500 -> 325000 | D28: of:=[.B28]+3 -> 29 | E28: of:=INT([.D28]/2) -> 14 | F28: of:=INT(1+[.$B28]/3) -> 9 | G28: of:=INT(2+[.$B28]/3) -> 10 | H28: of:=INT([.B28]/4) -> 6 | I28: of:=INT([.B28]/2) -> 13 | J28: of:=INT([.B28]/3) -> 8 | K28: of:=[.$B28]*3 -> 78 | L28: of:=[.$B28]*3 -> 78 | M28: of:=[.$B28]-[.F28]+7 -> 24 | N28: of:=([.$B28]+3)*2 -> 58 | O28: of:=([.$B28]+3)*8 -> 232 | P28: of:=([.$B28]+3)*9 -> 261 | Q28: of:=INT([.P28]/5) -> 52 | R28: of:=[.B28]-[.I28] -> 13 | S28: of:=2+INT([.$B28]/2) -> 15 | T28: of:=MAX([.T27];[.S28]-[.J28]) -> 7 | U28: of:=[.$B28]*9 -> 234 | V28: 999999
B29: of:=[.B28]+1 -> 27 | C29: of:=[.B29]*[.B28]*500 -> 351000 | D29: of:=[.B29]+3 -> 30 | E29: of:=INT([.D29]/2) -> 15 | F29: of:=INT(1+[.$B29]/3) -> 10 | G29: of:=INT(2+[.$B29]/3) -> 11 | H29: of:=INT([.B29]/4) -> 6 | I29: of:=INT([.B29]/2) -> 13 | J29: of:=INT([.B29]/3) -> 9 | K29: of:=[.$B29]*3 -> 81 | L29: of:=[.$B29]*3 -> 81 | M29: of:=[.$B29]-[.F29]+7 -> 24 | N29: of:=([.$B29]+3)*2 -> 60 | O29: of:=([.$B29]+3)*8 -> 240 | P29: of:=([.$B29]+3)*9 -> 270 | Q29: of:=INT([.P29]/5) -> 54 | R29: of:=[.B29]-[.I29] -> 14 | S29: of:=2+INT([.$B29]/2) -> 15 | T29: of:=MAX([.T28];[.S29]-[.J29]) -> 7 | U29: of:=[.$B29]*9 -> 243 | V29: 999999
B30: of:=[.B29]+1 -> 28 | C30: of:=[.B30]*[.B29]*500 -> 378000 | D30: of:=[.B30]+3 -> 31 | E30: of:=INT([.D30]/2) -> 15 | F30: of:=INT(1+[.$B30]/3) -> 10 | G30: of:=INT(2+[.$B30]/3) -> 11 | H30: of:=INT([.B30]/4) -> 7 | I30: of:=INT([.B30]/2) -> 14 | J30: of:=INT([.B30]/3) -> 9 | K30: of:=[.$B30]*3 -> 84 | L30: of:=[.$B30]*3 -> 84 | M30: of:=[.$B30]-[.F30]+7 -> 25 | N30: of:=([.$B30]+3)*2 -> 62 | O30: of:=([.$B30]+3)*8 -> 248 | P30: of:=([.$B30]+3)*9 -> 279 | Q30: of:=INT([.P30]/5) -> 55 | R30: of:=[.B30]-[.I30] -> 14 | S30: of:=2+INT([.$B30]/2) -> 16 | T30: of:=MAX([.T29];[.S30]-[.J30]) -> 7 | U30: of:=[.$B30]*9 -> 252 | V30: 999999
B31: of:=[.B30]+1 -> 29 | C31: of:=[.B31]*[.B30]*500 -> 406000 | D31: of:=[.B31]+3 -> 32 | E31: of:=INT([.D31]/2) -> 16 | F31: of:=INT(1+[.$B31]/3) -> 10 | G31: of:=INT(2+[.$B31]/3) -> 11 | H31: of:=INT([.B31]/4) -> 7 | I31: of:=INT([.B31]/2) -> 14 | J31: of:=INT([.B31]/3) -> 9 | K31: of:=[.$B31]*3 -> 87 | L31: of:=[.$B31]*3 -> 87 | M31: of:=[.$B31]-[.F31]+7 -> 26 | N31: of:=([.$B31]+3)*2 -> 64 | O31: of:=([.$B31]+3)*8 -> 256 | P31: of:=([.$B31]+3)*9 -> 288 | Q31: of:=INT([.P31]/5) -> 57 | R31: of:=[.B31]-[.I31] -> 15 | S31: of:=2+INT([.$B31]/2) -> 16 | T31: of:=MAX([.T30];[.S31]-[.J31]) -> 7 | U31: of:=[.$B31]*9 -> 261 | V31: 999999
B32: of:=[.B31]+1 -> 30 | C32: of:=[.B32]*[.B31]*500 -> 435000 | D32: of:=[.B32]+3 -> 33 | E32: of:=INT([.D32]/2) -> 16 | F32: of:=INT(1+[.$B32]/3) -> 11 | G32: of:=INT(2+[.$B32]/3) -> 12 | H32: of:=INT([.B32]/4) -> 7 | I32: of:=INT([.B32]/2) -> 15 | J32: of:=INT([.B32]/3) -> 10 | K32: of:=[.$B32]*3 -> 90 | L32: of:=[.$B32]*3 -> 90 | M32: of:=[.$B32]-[.F32]+7 -> 26 | N32: of:=([.$B32]+3)*2 -> 66 | O32: of:=([.$B32]+3)*8 -> 264 | P32: of:=([.$B32]+3)*9 -> 297 | Q32: of:=INT([.P32]/5) -> 59 | R32: of:=[.B32]-[.I32] -> 15 | S32: of:=2+INT([.$B32]/2) -> 17 | T32: of:=MAX([.T31];[.S32]-[.J32]) -> 7 | U32: of:=[.$B32]*9 -> 270 | V32: 999999

Sheet: Ability Scores
B2: Ability Score | C2: Bonus | D2: Cost
B3: 0 | C3: of:=INT(([.B3]-10)/2) -> -5 | D3: -10
B4: 1 | C4: of:=INT(([.B4]-10)/2) -> -5 | D4: of:=[.D3]+MAX(1;[.C4]) -> -9
B5: 2 | C5: of:=INT(([.B5]-10)/2) -> -4 | D5: of:=[.D4]+MAX(1;[.C5]) -> -8
B6: 3 | C6: of:=INT(([.B6]-10)/2) -> -4 | D6: of:=[.D5]+MAX(1;[.C6]) -> -7
B7: 4 | C7: of:=INT(([.B7]-10)/2) -> -3 | D7: of:=[.D6]+MAX(1;[.C7]) -> -6
B8: 5 | C8: of:=INT(([.B8]-10)/2) -> -3 | D8: of:=[.D7]+MAX(1;[.C8]) -> -5
B9: 6 | C9: of:=INT(([.B9]-10)/2) -> -2 | D9: of:=[.D8]+MAX(1;[.C9]) -> -4
B10: 7 | C10: of:=INT(([.B10]-10)/2) -> -2 | D10: of:=[.D9]+MAX(1;[.C10]) -> -3
B11: 8 | C11: of:=INT(([.B11]-10)/2) -> -1 | D11: of:=[.D10]+MAX(1;[.C11]) -> -2
B12: 9 | C12: of:=INT(([.B12]-10)/2) -> -1 | D12: of:=[.D11]+MAX(1;[.C12]) -> -1
B13: 10 | C13: of:=INT(([.B13]-10)/2) -> 0 | D13: of:=[.D12]+MAX(1;[.C13]) -> 0
B14: 11 | C14: of:=INT(([.B14]-10)/2) -> 0 | D14: of:=[.D13]+MAX(1;[.C14]) -> 1
B15: 12 | C15: of:=INT(([.B15]-10)/2) -> 1 | D15: of:=[.D14]+MAX(1;[.C15]) -> 2
B16: 13 | C16: of:=INT(([.B16]-10)/2) -> 1 | D16: of:=[.D15]+MAX(1;[.C16]) -> 3
B17: 14 | C17: of:=INT(([.B17]-10)/2) -> 2 | D17: of:=[.D16]+MAX(1;[.C17]) -> 5
B18: 15 | C18: of:=INT(([.B18]-10)/2) -> 2 | D18: of:=[.D17]+MAX(1;[.C18]) -> 7
B19: 16 | C19: of:=INT(([.B19]-10)/2) -> 3 | D19: of:=[.D18]+MAX(1;[.C19]) -> 10
B20: 17 | C20: of:=INT(([.B20]-10)/2) -> 3 | D20: of:=[.D19]+MAX(1;[.C20]) -> 13
B21: 18 | C21: of:=INT(([.B21]-10)/2) -> 4 | D21: of:=[.D20]+MAX(1;[.C21]) -> 17
B22: 19 | C22: of:=INT(([.B22]-10)/2) -> 4 | D22: of:=[.D21]+MAX(1;[.C22]) -> 21
B23: 20 | C23: of:=INT(([.B23]-10)/2) -> 5 | D23: of:=[.D22]+MAX(1;[.C23]) -> 26
B24: 21 | C24: of:=INT(([.B24]-10)/2) -> 5 | D24: of:=[.D23]+MAX(1;[.C24]) -> 31
B25: 22 | C25: of:=INT(([.B25]-10)/2) -> 6 | D25: of:=[.D24]+MAX(1;[.C25]) -> 37
B26: 23 | C26: of:=INT(([.B26]-10)/2) -> 6 | D26: of:=[.D25]+MAX(1;[.C26]) -> 43
B27: 24 | C27: of:=INT(([.B27]-10)/2) -> 7 | D27: of:=[.D26]+MAX(1;[.C27]) -> 50
B28: 25 | C28: of:=INT(([.B28]-10)/2) -> 7 | D28: of:=[.D27]+MAX(1;[.C28]) -> 57
B29: 26 | C29: of:=INT(([.B29]-10)/2) -> 8 | D29: of:=[.D28]+MAX(1;[.C29]) -> 65
B30: 27 | C30: of:=INT(([.B30]-10)/2) -> 8 | D30: of:=[.D29]+MAX(1;[.C30]) -> 73
B31: 28 | C31: of:=INT(([.B31]-10)/2) -> 9 | D31: of:=[.D30]+MAX(1;[.C31]) -> 82
B32: 29 | C32: of:=INT(([.B32]-10)/2) -> 9 | D32: of:=[.D31]+MAX(1;[.C32]) -> 91
B33: 30 | C33: of:=INT(([.B33]-10)/2) -> 10 | D33: of:=[.D32]+MAX(1;[.C33]) -> 101

Sheet: Races
B2: Default/Other | C2: 0 | D2: 0 | E2: 0 | F2: 0 | G2: 0 | H2: 0 | I2: 0 | J2: 8 | K2: 7 | L2: N/A | M2: 30 | N2: N/A | O2: Common
B4: Race | C4: Size | D4: Str | E4: Dex | F4: Con | G4: Int | H4: Wis | I4: Cha | J4: GP | K4: Feats | L4: Abilities | M4: Speed | N4: Bonus Lang | O4: Auto Lang
C5: of:=[.C$2] -> 0 | D5: of:=[.D$2] -> 0 | E5: of:=[.E$2] -> 0 | F5: of:=[.F$2] -> 0 | G5: of:=[.G$2] -> 0 | H5: of:=[.H$2] -> 0 | I5: of:=[.I$2] -> 0 | J5: of:=[.J$2] -> 8 | K5: of:=[.K$2] -> 7 | L5: of:=[.L$2] -> N/A | M5: of:=[.M$2] -> 30 | N5: of:=[.N$2] -> N/A | O5: of:=[.O$2] -> Common
B6: DWARF | C6: 0 | D6: 0 | E6: 0 | F6: 2 | G6: 0 | H6: 0 | I6: -2 | J6: 8 | K6: 7 | L6: +2 Constitution, -2 Charisma. [Already Included] Can move at full speed even when wearing medium or heavy armor or when carrying a medium or heavy load. 60ft Darkvision, Stonecunning, Weapon Familiarity: Dwarven, Stability, +2 vs poison, +2 vs spells and spell-like effects, +1 attack rolls against orcs and goblinoids, +4 Armor Class against giants, +2 Appraise stone or metal items, +2 Craft stone or metal. | M6: 20 | N6: Giant, Gnome, Goblin, Terran, and Undercommon | O6: Common, Dwarven
B7: of:=COM.MICROSOFT.CONCAT([.B6];" ") -> DWARF  | C7: of:=[.C$2] -> 0 | D7: of:=[.D$2] -> 0 | E7: of:=[.E$2] -> 0 | F7: of:=[.F$2] -> 0 | G7: of:=[.G$2] -> 0 | H7: of:=[.H$2] -> 0 | I7: of:=[.I$2] -> 0 | J7: of:=[.J$2] -> 8 | K7: of:=[.K$2] -> 7 | L7: of:=[.L$2] -> N/A | M7: of:=[.M$2] -> 30 | N7: of:=[.N$2] -> N/A | O7: of:=[.O$2] -> Common
B8: ELF | C8: 0 | D8: 0 | E8: 2 | F8: -2 | G8: 0 | H8: 0 | I8: 0 | J8: 8 | K8: 7 | L8: +2 Dexterity, -2 Constitution. [Already Included] Immunity to magical sleep, +2 vs enchantments, Low-Light Vision, Weapon Proficiency: longsword, rapier, longbow and shortbow. +2 Listen, +2 Search, +2 Spot, Secret Door Awareness. | M8: 30 | N8: Draconic, Gnoll, Gnome, Goblin, and Sylvan | O8: Common, Elven
B9: of:=COM.MICROSOFT.CONCAT([.B8];" ") -> ELF  | C9: of:=[.C$2] -> 0 | D9: of:=[.D$2] -> 0 | E9: of:=[.E$2] -> 0 | F9: of:=[.F$2] -> 0 | G9: of:=[.G$2] -> 0 | H9: of:=[.H$2] -> 0 | I9: of:=[.I$2] -> 0 | J9: of:=[.J$2] -> 8 | K9: of:=[.K$2] -> 7 | L9: of:=[.L$2] -> N/A | M9: of:=[.M$2] -> 30 | N9: of:=[.N$2] -> N/A | O9: of:=[.O$2] -> Common
B10: GNOME | C10: 1 | D10: -2 | E10: 0 | F10: 0 | G10: 2 | H10: -2 | I10: 2 | J10: 8 | K10: 7 | L10: +2 Intelligence, +2 Charisma, -2 Strength, -2 Wisdom. [Already Included] Low-Light Vision, Weapon Familiarity: Gnome, +2 vs illusions, +1 DC illusion spells, +1 attack rolls against kobolds and goblinoids, +4 AC against giants, +2 Listen, +2 Craft(alchemy), Bonus Spells: dancing lights, ghost sound, prestidigitation | M10: 20 | N10: Burrowing Animals, Draconic, Dwarven, Elven, Giant, and Goblin | O10: Common, Gnome
B11: of:=COM.MICROSOFT.CONCAT([.B10];" ") -> GNOME  | C11: of:=[.C$2] -> 0 | D11: of:=[.D$2] -> 0 | E11: of:=[.E$2] -> 0 | F11: of:=[.F$2] -> 0 | G11: of:=[.G$2] -> 0 | H11: of:=[.H$2] -> 0 | I11: of:=[.I$2] -> 0 | J11: of:=[.J$2] -> 8 | K11: of:=[.K$2] -> 7 | L11: of:=[.L$2] -> N/A | M11: of:=[.M$2] -> 30 | N11: of:=[.N$2] -> N/A | O11: of:=[.O$2] -> Common
B12: GOBLIN | C12: 1 | D12: -2 | E12: 2 | F12: 0 | G12: 0 | H12: 0 | I12: -2 | J12: 8 | K12: 7 | L12: -2 Strength, +2 Dexterity, -2 Charisma. [Already Included] 60ft Darkvision, +4 Move Silently, +4 Ride | M12: 30 | N12: Draconic, Elven, Giant, Gnoll, Gnome and Undercommon | O12: Common, Gnome
B13: of:=COM.MICROSOFT.CONCAT([.B12];" ") -> GOBLIN  | C13: of:=[.C$2] -> 0 | D13: of:=[.D$2] -> 0 | E13: of:=[.E$2] -> 0 | F13: of:=[.F$2] -> 0 | G13: of:=[.G$2] -> 0 | H13: of:=[.H$2] -> 0 | I13: of:=[.I$2] -> 0 | J13: of:=[.J$2] -> 8 | K13: of:=[.K$2] -> 7 | L13: of:=[.L$2] -> N/A | M13: of:=[.M$2] -> 30 | N13: of:=[.N$2] -> N/A | O13: of:=[.O$2] -> Common
B14: HALF ELF | C14: 0 | D14: 0 | E14: 0 | F14: 0 | G14: 0 | H14: 0 | I14: 0 | J14: 8 | K14: 7 | L14: Immunity to magical sleep, +2 vs enchantments, Low-Light Vision, +1 Listen, +1 Search, +1 Spot, +2 Diplomancy, +2 Gather Information, Elven Blood. | M14: 30 | N14: Any | O14: Common, Elven
B15: of:=COM.MICROSOFT.CONCAT([.B14];" ") -> HALF ELF  | C15: of:=[.C$2] -> 0 | D15: of:=[.D$2] -> 0 | E15: of:=[.E$2] -> 0 | F15: of:=[.F$2] -> 0 | G15: of:=[.G$2] -> 0 | H15: of:=[.H$2] -> 0 | I15: of:=[.I$2] -> 0 | J15: of:=[.J$2] -> 8 | K15: of:=[.K$2] -> 7 | L15: of:=[.L$2] -> N/A | M15: of:=[.M$2] -> 30 | N15: of:=[.N$2] -> N/A | O15: of:=[.O$2] -> Common
B16: HALF ORC | C16: 0 | D16: 2 | E16: 0 | F16: 0 | G16: -2 | H16: 0 | I16: -2 | J16: 8 | K16: 7 | L16: +2 Strength, -2 Intelligence, -2 Charisma. [Already Included] 60ft Darkvision, Orc Blood. | M16: 30 | N16: Draconic, Giant, Gnoll, Gnome, and Abyssal. | O16: Common, Goblin
B17: of:=COM.MICROSOFT.CONCAT([.B16];" ") -> HALF ORC  | C17: of:=[.C$2] -> 0 | D17: of:=[.D$2] -> 0 | E17: of:=[.E$2] -> 0 | F17: of:=[.F$2] -> 0 | G17: of:=[.G$2] -> 0 | H17: of:=[.H$2] -> 0 | I17: of:=[.I$2] -> 0 | J17: of:=[.J$2] -> 8 | K17: of:=[.K$2] -> 7 | L17: of:=[.L$2] -> N/A | M17: of:=[.M$2] -> 30 | N17: of:=[.N$2] -> N/A | O17: of:=[.O$2] -> Common
B18: HALFLING | C18: 1 | D18: -2 | E18: 2 | F18: 0 | G18: 0 | H18: 0 | I18: 0 | J18: 8 | K18: 7 | L18: +2 Dexterity, -2 Strength. [Already Included] +2 Climb, +2 Jump, +2 Listen, +2 Move Silently, +1 Ref, +1 Fort, +1 Will, +2 morale vs fear, +1 attack rolls thrown weapons and slings | M18: 20 | N18: Dwarven, Elven, Gnome, and Goblin | O18: Common
B19: of:=COM.MICROSOFT.CONCAT([.B18];" ") -> HALFLING  | C19: of:=[.C$2] -> 0 | D19: of:=[.D$2] -> 0 | E19: of:=[.E$2] -> 0 | F19: of:=[.F$2] -> 0 | G19: of:=[.G$2] -> 0 | H19: of:=[.H$2] -> 0 | I19: of:=[.I$2] -> 0 | J19: of:=[.J$2] -> 8 | K19: of:=[.K$2] -> 7 | L19: of:=[.L$2] -> N/A | M19: of:=[.M$2] -> 30 | N19: of:=[.N$2] -> N/A | O19: of:=[.O$2] -> Common
B20: HUMAN | C20: 0 | D20: 0 | E20: 0 | F20: 0 | G20: 0 | H20: 0 | I20: 0 | J20: 9 | K20: 8 | L20: Extra Feats and GP [Already Incoporated] | M20: 30 | N20: Any | O20: Common
B21: of:=COM.MICROSOFT.CONCAT([.B20];" ") -> HUMAN  | C21: of:=[.C$2] -> 0 | D21: of:=[.D$2] -> 0 | E21: of:=[.E$2] -> 0 | F21: of:=[.F$2] -> 0 | G21: of:=[.G$2] -> 0 | H21: of:=[.H$2] -> 0 | I21: of:=[.I$2] -> 0 | J21: of:=[.J$2] -> 8 | K21: of:=[.K$2] -> 7 | L21: of:=[.L$2] -> N/A | M21: of:=[.M$2] -> 30 | N21: of:=[.N$2] -> N/A | O21: of:=[.O$2] -> Common
B22: LIZARDFOLK | C22: 0 | D22: 2 | E22: -2 | F22: 2 | G22: -2 | H22: 0 | I22: 0 | J22: 8 | K22: 7 | L22: +2 Strength, -2 Dexterity, +2 Constitution, -2 Intelligence. [Already Included] +4 Balance, +4 Jump, +4 Swim, +3 natural armor, Natural Weapons: 2 claws (1d4) and bite (1d4), Hold breath(4xCon rounds). | M22: 30 | N22: Aquan, Goblin, Gnoll | O22: Common, Draconic
B23: of:=COM.MICROSOFT.CONCAT([.B22];" ") -> LIZARDFOLK  | C23: of:=[.C$2] -> 0 | D23: of:=[.D$2] -> 0 | E23: of:=[.E$2] -> 0 | F23: of:=[.F$2] -> 0 | G23: of:=[.G$2] -> 0 | H23: of:=[.H$2] -> 0 | I23: of:=[.I$2] -> 0 | J23: of:=[.J$2] -> 8 | K23: of:=[.K$2] -> 7 | L23: of:=[.L$2] -> N/A | M23: of:=[.M$2] -> 30 | N23: of:=[.N$2] -> N/A | O23: of:=[.O$2] -> Common

Sheet: Lookups
B3: of:=[$'Character Sheet'.$B$3] -> 0 | C3: of:=[$'Character Sheet'.$C$3] -> 22 | D3: of:=LOOKUP([.$C3];[$'Ability Scores'.$B$3:$'Ability Scores'.$B$33];[$'Ability Scores'.C$3:$'Ability Scores'.C$33]) -> 6 | E3: of:=LOOKUP([.$C3];[$'Ability Scores'.$B$3:$'Ability Scores'.$B$33];[$'Ability Scores'.D$3:$'Ability Scores'.D$33]) -> 37 | F3: of:=[.C3]-[.D15] -> 22 | G3: of:=LOOKUP([.$F3];[$'Ability Scores'.$B$3:$'Ability Scores'.$B$33];[$'Ability Scores'.D$3:$'Ability Scores'.D$33]) -> 37
B4: of:=[$'Character Sheet'.$B$4] -> 0 | C4: of:=[$'Character Sheet'.$C$4] -> 10 | D4: of:=LOOKUP([.$C4];[$'Ability Scores'.$B$3:$'Ability Scores'.$B$33];[$'Ability Scores'.C$3:$'Ability Scores'.C$33]) -> 0 | E4: of:=LOOKUP([.$C4];[$'Ability Scores'.$B$3:$'Ability Scores'.$B$33];[$'Ability Scores'.D$3:$'Ability Scores'.D$33]) -> 0 | F4: of:=[.C4]-[.E15] -> 10 | G4: of:=LOOKUP([.$F4];[$'Ability Scores'.$B$3:$'Ability Scores'.$B$33];[$'Ability Scores'.D$3:$'Ability Scores'.D$33]) -> 0
B5: of:=[$'Character Sheet'.$B$5] -> 0 | C5: of:=[$'Character Sheet'.$C$5] -> 16 | D5: of:=LOOKUP([.$C5];[$'Ability Scores'.$B$3:$'Ability Scores'.$B$33];[$'Ability Scores'.C$3:$'Ability Scores'.C$33]) -> 3 | E5: of:=LOOKUP([.$C5];[$'Ability Scores'.$B$3:$'Ability Scores'.$B$33];[$'Ability Scores'.D$3:$'Ability Scores'.D$33]) -> 10 | F5: of:=[.C5]-[.F15] -> 16 | G5: of:=LOOKUP([.$F5];[$'Ability Scores'.$B$3:$'Ability Scores'.$B$33];[$'Ability Scores'.D$3:$'Ability Scores'.D$33]) -> 10
B6: of:=[$'Character Sheet'.$B$6] -> 0 | C6: of:=[$'Character Sheet'.$C$6] -> 8 | D6: of:=LOOKUP([.$C6];[$'Ability Scores'.$B$3:$'Ability Scores'.$B$33];[$'Ability Scores'.C$3:$'Ability Scores'.C$33]) -> -1 | E6: of:=LOOKUP([.$C6];[$'Ability Scores'.$B$3:$'Ability Scores'.$B$33];[$'Ability Scores'.D$3:$'Ability Scores'.D$33]) -> -2 | F6: of:=[.C6]-[.G15] -> 8 | G6: of:=LOOKUP([.$F6];[$'Ability Scores'.$B$3:$'Ability Scores'.$B$33];[$'Ability Scores'.D$3:$'Ability Scores'.D$33]) -> -2
B7: of:=[$'Character Sheet'.$B$7] -> 0 | C7: of:=[$'Character Sheet'.$C$7] -> 8 | D7: of:=LOOKUP([.$C7];[$'Ability Scores'.$B$3:$'Ability Scores'.$B$33];[$'Ability Scores'.C$3:$'Ability Scores'.C$33]) -> -1 | E7: of:=LOOKUP([.$C7];[$'Ability Scores'.$B$3:$'Ability Scores'.$B$33];[$'Ability Scores'.D$3:$'Ability Scores'.D$33]) -> -2 | F7: of:=[.C7]-[.H15] -> 8 | G7: of:=LOOKUP([.$F7];[$'Ability Scores'.$B$3:$'Ability Scores'.$B$33];[$'Ability Scores'.D$3:$'Ability Scores'.D$33]) -> -2
B8: of:=[$'Character Sheet'.$B$8] -> 0 | C8: of:=[$'Character Sheet'.$C$8] -> 10 | D8: of:=LOOKUP([.$C8];[$'Ability Scores'.$B$3:$'Ability Scores'.$B$33];[$'Ability Scores'.C$3:$'Ability Scores'.C$33]) -> 0 | E8: of:=LOOKUP([.$C8];[$'Ability Scores'.$B$3:$'Ability Scores'.$B$33];[$'Ability Scores'.D$3:$'Ability Scores'.D$33]) -> 0 | F8: of:=[.C8]-[.I15] -> 10 | G8: of:=LOOKUP([.$F8];[$'Ability Scores'.$B$3:$'Ability Scores'.$B$33];[$'Ability Scores'.D$3:$'Ability Scores'.D$33]) -> 0
F9: Total | G9: of:=SUM([.G3:.G8]) -> 43
B11: of:=[$'Level Table'.B$2] ->  Lvl  | C11: of:=[$'Level Table'.C$2] ->  XP      | D11: of:=[$'Level Table'.D$2] -> Class Skill Max | E11: of:=[$'Level Table'.E$2] ->  X-Class Skill Max | F11: of:=[$'Level Table'.F$2] ->  Bonus Feats | G11: of:=[$'Level Table'.G$2] -> Bonus Feats (Human) | H11: of:=[$'Level Table'.H$2] -> Stat Bonus | I11: of:=[$'Level Table'.I$2] -> Base BAB | J11: of:=[$'Level Table'.J$2] -> Base Save | K11: of:=[$'Level Table'.K$2] ->  Base HP  | L11: of:=[$'Level Table'.L$2] ->  Base SP  | M11: of:=[$'Level Table'.M$2] -> Base Feats | N11: of:=[$'Level Table'.N$2] ->  Skill Points  | O11: of:=[$'Level Table'.O$2] -> GP | P11: of:=[$'Level Table'.P$2] -> GP (Human) | Q11: of:=[$'Level Table'.Q$2] ->  Max Extra  Feats | R11: of:=[$'Level Table'.R$2] ->  Max Extra BAB | S11: of:=[$'Level Table'.S$2] -> Good Save | T11: of:=[$'Level Table'.T$2] -> Max Extra Save | U11: of:=[$'Level Table'.U$2] -> Max Extra HP | V11: of:=[$'Level Table'.V$2] -> Max Extra SP
B12: of:=[$'Character Sheet'.$L$4] -> 10 | C12: of:=LOOKUP([.$B$12];[$'Level Table'.$B$3:$'Level Table'.$B$32];[$'Level Table'.C$3:$'Level Table'.C$32]) -> 45000 | D12: of:=LOOKUP([.$B$12];[$'Level Table'.$B$3:$'Level Table'.$B$32];[$'Level Table'.D$3:$'Level Table'.D$32]) -> 13 | E12: of:=LOOKUP([.$B$12];[$'Level Table'.$B$3:$'Level Table'.$B$32];[$'Level Table'.E$3:$'Level Table'.E$32]) -> 6 | F12: of:=LOOKUP([.$B$12];[$'Level Table'.$B$3:$'Level Table'.$B$32];[$'Level Table'.F$3:$'Level Table'.F$32]) -> 4 | G12: of:=LOOKUP([.$B$12];[$'Level Table'.$B$3:$'Level Table'.$B$32];[$'Level Table'.G$3:$'Level Table'.G$32]) -> 5 | H12: of:=LOOKUP([.$B$12];[$'Level Table'.$B$3:$'Level Table'.$B$32];[$'Level Table'.H$3:$'Level Table'.H$32]) -> 2 | I12: of:=LOOKUP([.$B$12];[$'Level Table'.$B$3:$'Level Table'.$B$32];[$'Level Table'.I$3:$'Level Table'.I$32]) -> 5 | J12: of:=LOOKUP([.$B$12];[$'Level Table'.$B$3:$'Level Table'.$B$32];[$'Level Table'.J$3:$'Level Table'.J$32]) -> 3 | K12: of:=LOOKUP([.$B$12];[$'Level Table'.$B$3:$'Level Table'.$B$32];[$'Level Table'.K$3:$'Level Table'.K$32]) -> 30 | L12: of:=LOOKUP([.$B$12];[$'Level Table'.$B$3:$'Level Table'.$B$32];[$'Level Table'.L$3:$'Level Table'.L$32]) -> 30 | M12: of:=LOOKUP([.$B$12];[$'Level Table'.$B$3:$'Level Table'.$B$32];[$'Level Table'.M$3:$'Level Table'.M$32]) -> 13 | N12: of:=LOOKUP([.$B$12];[$'Level Table'.$B$3:$'Level Table'.$B$32];[$'Level Table'.N$3:$'Level Table'.N$32]) -> 26 | O12: of:=LOOKUP([.$B$12];[$'Level Table'.$B$3:$'Level Table'.$B$32];[$'Level Table'.O$3:$'Level Table'.O$32]) -> 104 | P12: of:=LOOKUP([.$B$12];[$'Level Table'.$B$3:$'Level Table'.$B$32];[$'Level Table'.P$3:$'Level Table'.P$32]) -> 117 | Q12: of:=LOOKUP([.$B$12];[$'Level Table'.$B$3:$'Level Table'.$B$32];[$'Level Table'.Q$3:$'Level Table'.Q$32]) -> 23 | R12: of:=LOOKUP([.$B$12];[$'Level Table'.$B$3:$'Level Table'.$B$32];[$'Level Table'.R$3:$'Level Table'.R$32]) -> 5 | S12: of:=LOOKUP([.$B$12];[$'Level Table'.$B$3:$'Level Table'.$B$32];[$'Level Table'.S$3:$'Level Table'.S$32]) -> 7 | T12: of:=LOOKUP([.$B$12];[$'Level Table'.$B$3:$'Level Table'.$B$32];[$'Level Table'.T$3:$'Level Table'.T$32]) -> 4 | U12: of:=LOOKUP([.$B$12];[$'Level Table'.$B$3:$'Level Table'.$B$32];[$'Level Table'.U$3:$'Level Table'.U$32]) -> 90 | V12: of:=LOOKUP([.$B$12];[$'Level Table'.$B$3:$'Level Table'.$B$32];[$'Level Table'.V$3:$'Level Table'.V$32]) -> 999999
B14: of:=[$Races.B$4] -> Race | C14: of:=[$Races.C$4] -> Size | D14: of:=[$Races.D$4] -> Str | E14: of:=[$Races.E$4] -> Dex | F14: of:=[$Races.F$4] -> Con | G14: of:=[$Races.G$4] -> Int | H14: of:=[$Races.H$4] -> Wis | I14: of:=[$Races.I$4] -> Cha | J14: of:=[$Races.J$4] -> GP | K14: of:=[$Races.K$4] -> Feats | L14: of:=[$Races.L$4] -> Abilities | M14: of:=[$Races.M$4] -> Speed | N14: of:=[$Races.N$4] -> Bonus Lang | O14: of:=[$Races.O$4] -> Auto Lang
A15: of:=UPPER([$'Character Sheet'.$I$1]) -> HUMAN | B15: of:=LOOKUP([.$A$15];[$Races.$B$5:$Races.$B$23];[$Races.B$5:$Races.B$23]) -> HUMAN | C15: of:=LOOKUP([.$A$15];[$Races.$B$5:$Races.$B$23];[$Races.C$5:$Races.C$23]) -> 0 | D15: of:=LOOKUP([.$A$15];[$Races.$B$5:$Races.$B$23];[$Races.D$5:$Races.D$23]) -> 0 | E15: of:=LOOKUP([.$A$15];[$Races.$B$5:$Races.$B$23];[$Races.E$5:$Races.E$23]) -> 0 | F15: of:=LOOKUP([.$A$15];[$Races.$B$5:$Races.$B$23];[$Races.F$5:$Races.F$23]) -> 0 | G15: of:=LOOKUP([.$A$15];[$Races.$B$5:$Races.$B$23];[$Races.G$5:$Races.G$23]) -> 0 | H15: of:=LOOKUP([.$A$15];[$Races.$B$5:$Races.$B$23];[$Races.H$5:$Races.H$23]) -> 0 | I15: of:=LOOKUP([.$A$15];[$Races.$B$5:$Races.$B$23];[$Races.I$5:$Races.I$23]) -> 0 | J15: of:=LOOKUP([.$A$15];[$Races.$B$5:$Races.$B$23];[$Races.J$5:$Races.J$23]) -> 9 | K15: 9 | L15: of:=LOOKUP([.$A$15];[$Races.$B$5:$Races.$B$23];[$Races.L$5:$Races.L$23]) -> Extra Feats and GP [Already Incoporated] | M15: of:=LOOKUP([.$A$15];[$Races.$B$5:$Races.$B$23];[$Races.M$5:$Races.M$23]) -> 30 | N15: of:=LOOKUP([.$A$15];[$Races.$B$5:$Races.$B$23];[$Races.N$5:$Races.N$23]) -> Any | O15: of:=LOOKUP([.$A$15];[$Races.$B$5:$Races.$B$23];[$Races.O$5:$Races.O$23]) -> Common
B18: 1 Simple | C18: 0 | E18: 1 Simple
B19: 2 Martial | C19: 2 | E19: All Simple
B20: All Martial | C20: 3 | E20: 2 Martial
B21: All Simple | C21: 1 | E21: All Martial
B23: Heavy | C23: 3 | E23: None
B24: Light | C24: 1 | E24: Light
B25: Medium | C25: 2 | E25: Medium
B26: None | C26: 0 | E26: Heavy
B28: Main-Hand | C28: 1 | E28: Off-Hand
B29: Off-Hand | C29: 0.5 | E29: Main-Hand
B30: Ranged | C30: 0 | E30: Two-Hand
B31: Thrown | C31: 1 | E31: Thrown
B32: Two-Hand | C32: 1.5 | E32: Ranged